,Text in Constant_Laure1,Text in B,Location in Constant_Laure1,Location in B
Dorat_Malheurs_0,des chimères dans les romans: JE NE CROIS PAS QUE VOUS AYEZ la satisfaction d'en trouver ," ordres; et pendant ce temps, JE NE CROIS PAS QUE VOUS AYEZ découvert en moi la moindre a","(118270, 118299)","(85825, 85854)"
Duclos_Acajou_0,certainement je ne connoîtrai NI LES UNS NI LES AUTRES; JE les défie tous: les hommes av, trop vifs l'exagerent ; mais NI LES UNS NI LES AUTRES N'AIMENT les réflexions : c'est pourqu,"(21400, 21428)","(3309, 3342)"
Florian_Estelle_0,mme d'un homme dont le mérite ET LA TENDRESSE QU'IL AVAIT POUR MOI m'ont fait trouver de la douc,ndre le jeune comte d'Assier; ET LA TENDRESSE QU'IL AVAIT POUR MOI est immolée à cette ambition*,"(78488, 78524)","(144104, 144140)"
Florian_Galatee_0,"Omment, ma chère amie! malgré TOUT CE QUE JE PUIS VOUS DIRE, vous avouez tout uniment que", une vaine réconnaissance est TOUT CE QUE JE PUIS VOUS OFFRIR. Vous pouvez nous raconter vo,"(40664, 40693)","(61181, 61212)"
Genlis_Adele_0,"Omment, ma chère amie! malgré TOUT CE QUE JE PUIS VOUS DIRE, vous avouez tout uniment que","désirs d'en savoir davantage: TOUT CE QUE JE PUIS VOUS DIRE, répondit-il, c'est que ce je","(40664, 40693)","(805345, 805374)"
Genlis_Chevaliers_0,"Omment, ma chère amie! malgré TOUT CE QUE JE PUIS VOUS DIRE, vous avouez tout uniment que","nom de mon indigne ravisseur; TOUT CE QUE JE PUIS VOUS DIRE, c'est que, dans une de nos s","(40664, 40693)","(184248, 184277)"
Genlis_Chevaliers_1,"dans ma chambre, bien occupée DE TOUT CE QUE JE VENAIS D'ENTENDRE. J'aurois bien de la peine à ", et le cœur également remplis DE TOUT CE QUE JE VENAIS D'ENTENDRE. Je passai près d'un mois de ,"(96135, 96170)","(184248, 184277)"
Jacquin_Parisiennes_0,"s tendres: l'amour, même, qui EST LA PIERRE DE TOUCHE DE LA métaphysique, semble aussi av",mpardonnable: la belle humeur EST LA PIERRE DE TOUCHE DE LA société: quiconque ne répond ,"(4589, 4618)","(250039, 250068)"
Laclos_Liaisons_0,"Omment, ma chère amie! malgré TOUT CE QUE JE PUIS VOUS DIRE, vous avouez tout uniment que"," perdre que de la surprendre. TOUT CE QUE JE PUIS VOUS DIRE, c'est que, placée par M. de ","(40664, 40693)","(619365, 619394)"
Laclos_Liaisons_1,"s allez faire vœu de célibat. JE NE CROIS PAS QUE CE SOIT un grand effort, mais je ne m","infecte encore nos mœurs ; et JE NE CROIS PAS QUE CE SOIT dans ce cas, que le pardon de","(116933, 116960)","(619365, 619394)"
Lagrave_Zabeth_0,"Omment, ma chère amie! malgré TOUT CE QUE JE PUIS VOUS DIRE, vous avouez tout uniment que","t: je ne puis vous en donner. TOUT CE QUE JE PUIS VOUS DIRE, c'est que la vieille femme c","(40664, 40693)","(285896, 285925)"
Lesuire_Crime_0,"Omment, ma chère amie! malgré TOUT CE QUE JE PUIS VOUS DIRE, VOUS avouez tout uniment que vous ","ent instruits, repartis-je, de “TOUT CE QUE JE PUIS VOUS DIRE; VOus me “détaillez exactement to","(40664, 40699)","(521499, 521534)"
Louvet_Annee_0,"Omment, ma chère amie! malgré TOUT CE QUE JE PUIS VOUS DIRE, vous avouez tout uniment que","e absolument, me répondit-il: TOUT CE QUE JE PUIS VOUS DIRE, c'est qu'hier au soir, vous ","(40664, 40693)","(144267, 144296)"
Louvet_Fin_0,des chimères dans les romans: JE NE CROIS PAS QUE VOUS AYEZ la satisfaction d'en trouver ,donc?—Une jeune personne dont JE NE CROIS PAS QUE VOUS AYEZ entendu parler.—Vous l'appele,"(118270, 118299)","(81681, 81710)"
Marmontel_Contes_0,"Omment, ma chère amie! malgré TOUT CE QUE JE PUIS VOUS DIRE, vous avouez tout uniment que",encore plus malheureux: c'est TOUT CE QUE JE PUIS VOUS DIRE. Ne vous offensez pas de mon ,"(40664, 40693)","(331125, 331154)"
Merard_Bergeries_0, ai un peu froncé le sourcil; IL EST VRAI QUE JE N'AI JAMAIS rien entendu dire sur ma rais,"ie! Après t'avoir offensée... IL EST VRAI QUE JE N'AI JAMAIS cessé de t'aimer. L'ambition,","(15849, 15879)","(13257, 13287)"
Nerciat_Etourdi_0,i se sont ruinés ont toujours DE LA POLITESSE ET DE L'USAGE DU MONDE; on voit à leur air triste et,"me pour elles, mais seulement DE LA POLITESSE ET DE L'USAGE DU MONDE. Conclusion : il faut les mép","(37359, 37397)","(50951, 50989)"
Nerciat_Felicia_0, ai un peu froncé le sourcil; IL EST VRAI QUE JE N'AI JAMAIS rien entendu dire sur ma rais,t toujours demeurés mes amis. IL EST VRAI QUE JE N'AI JAMAIS fait de mauvais choix. Je ne ,"(15849, 15879)","(391589, 391619)"
Prevost_Monde_0,"puisqu'il dépendra du hasard, DE LA FORTUNE ET DE LA VERTU des hommes. Je sais que vous ","ndra de moi le nouveau lustre DE LA FORTUNE ET DE LA VERTU. J'étais incertaine, il y a d","(189084, 189112)","(284210, 284238)"
Retif_Paysanne_0,"Omment, ma chère amie! malgré TOUT CE QUE JE PUIS VOUS DIRE, vous avouez tout uniment que"," jamais d'entrer par lettre ; TOUT CE QUE JE PUIS VOUS DIRE, c'est que si j'ai fait manqu","(40664, 40693)","(18833, 18862)"
Retif_Paysanne_1,"e crois en avoir la force, et JE NE SAIS PAS CE QUE VOUS trouvez là de si exalté et de","es de Joigny , et d'ailleurs. JE NE SAIS PAS CE QUE VOUS veut dire celui que vous appe","(56684, 56710)","(18833, 18862)"
Retif_Paysanne_2,des chimères dans les romans: JE NE CROIS PAS QUE VOUS AYEZ la satisfaction d'en trouver ,e envie d'épouser le marquis. JE NE CROIS PAS QUE VOUS AYEZ été la dupe de mes dédains. M,"(118270, 118299)","(18833, 18862)"
Riccoboni_LettreJuliette_0,"y vole. Adieu, ma chère amie, AIMEZ-MOI COMME JE VOUS AIME. 
LETTRE III. 
De la même. 
EN vérité, mad","patience... adieu, aimez-moi, AIMEZ-MOI COMME JE VOUS AIME. 
LETTRE 3 JEUDI, de chez Milord D'Erby. 
je v","(27393, 27434)","(4845, 4890)"
Riccoboni_LettreJuliette_1, et en conscience il faut que JE VOUS DISE TOUT CE QUE JE sais de cette nouvelle voisin,"re, c'est que je vous ennuie. JE VOUS DIS TOUT CE QUE JE pense, et je ne pense rien d'","(68452, 68479)","(4845, 4890)"
Riccoboni_LettresFanni_0,"ispositions à la coquetterie, CAR IL M'EST IMPOSSIBLE DE NE PAS y revenir: mais, dites-moi, j"," toute émue, et puis de rire; CAR IL EST IMPOSSIBLE DE NE PAS rire d'une telle sottise. 
à ","(107577, 107610)","(47783, 47814)"
Rousseau_Emile_0,"ais il est dangereux d'imiter LES GRANDS HOMMES DANS LES PETITES CHOSES, et je vous assure, monsieur,",ne grâce inimitable à peindre LES GRANDS HOMMES DANS LES PETITES CHOSES; etamp; il est si heureux dan,"(2659, 2700)","(635074, 635115)"
Rousseau_Emile_1,"e assez haut, „je l'entendis; JE LUI DIS, EN LE REGARDANT FIXEMENT, QUE dans un moment je le prierois"," une lettre à la main, etamp; JE LUI DIS EN LE REGARDANT FIXEMENT: QUE feriez-vous si l'on vous appr","(89156, 89197)","(635074, 635115)"
Rousseau_Julie_0,i se sont ruinés ont toujours DE LA POLITESSE ET DE L'USAGE DU MONDE; on voit à leur air triste et,"ent ni estime, mais seulement DE LA POLITESSE ET DE L’USAGE DU MONDE; car d’ailleurs il n’est pas ","(37359, 37397)","(524342, 524380)"
Rousseau_Julie_1,é avec le plus grand intérêt; JE SUIS ENTRÉE DANS TOUS LES DÉTAILS; j'ai voulu aller voir le mal,"rmir la sécurité du présent. 
JE SUIS ENTRÉ DANS TOUS LES DÉTAILS du ménage et j’ai par-tout vu","(60872, 60908)","(524342, 524380)"
Sade_120_0,"Omment, ma chère amie! malgré TOUT CE QUE JE PUIS VOUS DIRE, vous avouez tout uniment que","faire rouer, messieurs, c'est TOUT CE QUE JE PUIS VOUS DIRE, indépendamment de billets cl","(40664, 40693)","(428067, 428096)"
Sade_Aline_0,avantages que peuvent „donner LES AGRÉMENT DE LA FIGURE ET „DE L'ESPRIT. Vous ne feriez une „reforme ,"th de Kerneuil, douée de tous LES AGRÉMENT DE LA FIGURE ET DE L’ESPRIT, mais fille d’une mère qui ne","(91415, 91456)","(272206, 272246)"
Sade_Infortunes_0,raître „sa conquête; j'allois AU-DEVANT DE „TOUT CE QUI POUVAIT LUI PLAIRE; je „lui faisais voir tout l',"du désir que j'avais de voler AU-DEVANT DE TOUT CE QUI POUVAIT LUI PLAIRE, il ne se pouvait pas qu'il n","(85267, 85311)","(68963, 69006)"
Sade_Justine_0,raître „sa conquête; j'allois AU-DEVANT DE „TOUT CE QUI POUVAIT LUI PLAIRE; je „lui faisais voir tout l',du désir que j'avais de voler AU-DEVANT DE TOUT CE QUI POUVAIT LUI PLAIRE ; il ne se pouvait pas qu'il ,"(85267, 85311)","(125074, 125117)"
Sade_Philosophie_0,"Omment, ma chère amie! malgré TOUT CE QUE JE PUIS VOUS DIRE, vous avouez tout uniment que","us ferez sera bienfait, c'est TOUT CE QUE JE PUIS VOUS DIRE ; elle va suivre ma lettre de","(40664, 40693)","(343588, 343617)"
Segur_Correspondance_0," l'amitié que j'ai pour vous; JE VOUS DIS QUE JE VOUS AIME, et vous me répondez que vous",a période ne n'emporte point; JE VOUS DIS QUE JE VOUS AIME par la raison que je le sens ,"(17253, 17281)","(148944, 148972)"
Segur_Correspondance_1,ageais la joie et le plaisirs DE TOUT LE MONDE; IL EST VRAI QUE je fus payée de ma peine par ,tes aujourd'hui la coqueluche DE TOUT LE MONDE; IL EST VRAI QUE votre mérite n'est pas postic,"(64275, 64308)","(148944, 148972)"
Senac_Emigre_0,"s s'ennuyer et être heureuse? JE NE LE CROIS PAS AU-DESSUS de mes forces, je veux l'entr","est, et au rang, et à l'âge prÈS, JE NE LE CROIS PAS AU-DEssus du mari de la Comtesse. L","(19317, 19345)","(672842, 672870)"
Souza_Adele_0,ir trop de confiance. J'avoue QUE DANS LE PREMIER MOMENT JE NE fus pas sans quelques désirs ," jusqu'à présent; il est vrai QUE, DANS LE PREMIER MOMENT, JE NE voyais que le danger de le co","(97137, 97169)","(203825, 203859)"
Tiphaigne_Amilec_0,certainement je ne connoîtrai NI LES UNS NI LES AUTRES; JE les défie tous: les hommes av,"u femelle fournit seul les tubULES FEMELLES. MAIS NI LES "" uns ni les autres de ces germi","(21400, 21428)","(48541, 48570)"
Voltaire_Candide_0,"ement, que je vous assure que JE NE PENSE RIEN DE TOUT CELA: jamais l'idée de mariage ne ","ieur, lui répondit le savant, JE NE PENSE RIEN DE TOUT CELA : je trouve que tout va de tr","(41211, 41240)","(127780, 127809)"
Voltaire_Candide_1,"é, de faire voir à mon cousin QUE JE N'AVAIS BESOIN DE PERSONNE POUR me garder, n'y entra pour rie","'en savais autant que lui, et QUE JE N'AVAIS BESOIN DE PERSONNE POUR être ignorant. 
--- Ah ! voil","(100031, 100069)","(127780, 127809)"
