,Text in Diderot_Religieuse,Text in B,Location in Diderot_Religieuse,Location in B
Arnaud_Matinees_0,: on ne conçoit guère comment UNE FILLE DE DIX-SEPT À DIX-HUIT ans a pu se porter à cette ex,"ylord, un des gentilshommes viVANT DANS VOS DÉPENDANCES, VIENT de mourir: il était veuf, et ","(57315, 57347)","(330190, 330222)"
Arnaud_Sentiment_0,"nous étions venues au monde à PEU DE DISTANCE LES UNES DES AUTRES, nous devînmes grandes tous l","eurs petits villages situés à PEU DE DISTANCE LES UNS DES AUTRES,Adelson reprend ainsi: je sui","(22054, 22089)","(848442, 848476)"
Arnaud_Sentiment_1,"Autant qu'elle l'a voulu. 
---CE N'EST PAS LÀ CE QUE VOUS M'AVIEZ PROMIS. 
---Je ne vous ai rien promi",s voyez que je sais me taire. CE N'EST PAS LÀ CE QUE VOUS M'AVIEZ PROMIS. J'ai fait tout ce que l'huma,"(268351, 268393)","(848442, 848476)"
Beaumont_Clarice_0,s prétentions à la succession DE MON PÈRE ET DE MA MÈRE ; JE n'épargnai rien pour leur per,"es qui doivent payer les pensiONS DE MON PÈRE ET DE MA MÈRE, je veux les leur porter à le","(131234, 131264)","(36940, 36969)"
Beaumont_Clarice_1,"c quelque chose de pointu ; » ET LEVANT LES YEUX ET LES MAINS au ciel, j'ajoutai en versant"," me fournir une voiture. PendaNT QUE JE FAISAIS CES RÉFLEXIONs, cette femme s'approchait, e","(174237, 174268)","(36940, 36969)"
Beaumont_Clarice_2,"usieurs jours de suite. Voilà LA LETTRE QUE VOUS LUI AVEZ ÉCRITE. J'en fais partir une autre, ", en lieu où il nous découvrira BIEN DES MYSTÈRES. CETTE MENACE A rendu votre père plus traitab,"(393608, 393642)","(36940, 36969)"
Bernardin_Paul_0," ne vous disaient rien ? 
--- JE NE SAIS CE QUE C'EST QUE le langage des sens. 
---Ils ",ère me l'a dit ; car pour moi JE NE SAIS CE QUE C'EST QUE la naissance. Je ne me suis j,"(279370, 279397)","(277651, 277678)"
bible_0,omme à vous ; je lui dis tout CE QUE JE VIENS DE VOUS ÉCRIRE ; et ce qui regardait ma nais,"à
ne pas penser autrement que CE QUE JE VIENS DE VOUS ÉCRIRE ; de peur que
vous ne vous en","(74282, 74312)","(4251973, 4252003)"
Charriere_Lausanne_0,"faire... S'il arrivait, après CE QUE JE VIENS DE VOUS DIRE, que j'eusse le courage..., e","rte que vive, elle me raconta CE QUE JE VIENS DE VOUS DIRE.-Mais, maman, disait-elle, co","(140862, 140890)","(90357, 90385)"
Charriere_Lausanne_1,"timents les plus respectueux, MONSIEUR, VOTRE TRÈS-HUMBLE ET TRÈS-OBÉISSANTE SERVANTE, Signé : Moreau-Madin. 
À Par","je dois me conduire. Je suis, MONSIEUR, VOTRE TRÈS HUMBLE ET TRÈS OBÉISSANTE SERVANTE. 
Madame, il est vrai que je ","(405712, 405767)","(90357, 90385)"
Chevrier_Colporteur_0,"ismare, chevalier grand-croix DE L'ORDRE ROYAL ET MILITAIRE DE SAINT-LOUIS, lieutenant général des armée",es tailleurs et les croupiers DE L'ORDRE ROYAL ET MILITAIRE DE SAINT LOUIS; il y a dans Paris deux mille,"(17563, 17607)","(72815, 72859)"
Constant_Laure1_0,"i ? 
---Vous le dirai-je ? Et POURQUOI NE VOUS LE DIRAIS-JE PAS ? C'est une délicatesse qui f", curiosité de savoir le mien. POURQUOI NE VOUS LE DIRAIS-JE PAS? Je ne veux pas que vous croy,"(252431, 252464)","(150624, 150657)"
Cottin_Claire_0,ibilité jusqu'à la férocité ; JE NE SAIS PAS CE QUE JE deviendrais. Promettez-moi de,"eût été trop heureuse... Mais JE NE SAIS PAS CE QUE JE dis ; pardonne, Élise, ma têt","(269063, 269087)","(82140, 82164)"
Crebillon_Conte_0,ier moment ; elle m'éloigne ; ET JE VOUS AVOUE QUE JE NE suis pas en état de soutenir ,que vous recevez vos visites; ET JE VOUS AVOUE QUE JE NE saurais comment vous rendre g,"(423542, 423568)","(110055, 110081)"
Crebillon_Nuit_0,ent comme à vous ; je lui dis TOUT CE QUE JE VIENS DE VOUS écrire ; et ce qui regardait ," propose... 
CIDALISE. 
Après TOUT CE QUE JE VIENS DE VOUS dire, ce serait à moi une ass","(74277, 74305)","(51203, 51231)"
Diderot_Jacques_0,"eur ; je ne demande rien. 
---VOUS NE SAVEZ PAS CE QUE C'EST QUE la peine, le travail, l'indig","ppelé votre ami... 
LE MAÎTRE VOUS NE SAVEZ PAS CE QUE C'EST QUE le nom d'ami donné par un sup","(54069, 54103)","(292838, 292872)"
Diderot_Jacques_1,eu. Songez que le parjure est LE PLUS GRAND DE TOUS LES CRIMES ; que vous l'avez déjà commis,"ux duquel le jansénisme était LE PLUS GRAND DE TOUS LES CRIMES, et la soumission à la bulle ","(133489, 133521)","(292838, 292872)"
Diderot_Jacques_2,"zanne, ayez pitié de moi... » ET EN DISANT CES MOTS, LA VOILÀ qui tombe renversée à moitié ","out ce qu'il vous plaira... » ET EN DISANT CES MOTS, LA VOILÀ fondant en pleurs et suffoqué","(154946, 154977)","(292838, 292872)"
Diderot_Neveu_0," rien faire... S'il arrivait, APRÈS CE QUE JE VIENS DE VOUS dire, que j'eusse le courage.","e ne soit indiscréte. 
LUI.---APRÈS CE QUE JE VIENS DE VOUS révéler, j'ignore quel secret","(140856, 140885)","(112273, 112302)"
Diderot_Supplement_0," d'autres m'entouraient et me TENAIENT EMBRASSÉE PAR LE MILIEU DU CORPS, comme si elles eussent crain",ns sa cabane : les hommes les TENAIENT EMBRASSÉS PAR LE MILIEU DU CORPS ; les femmes leur flattaient ,"(171489, 171530)","(25115, 25156)"
Dorat_Malheurs_0,n long sermon où il n'y avait PAS UN MOT QUI NE FÛT À CONTRE-sens ; c'était quelque chose ,s les plus étudiés. Je ne dis PAS UN MOT QUI NE FÛT PROFONDÉMENT senti. D'abord elle voulut s',"(44159, 44189)","(46147, 46181)"
Dorat_Malheurs_1,ent comme à vous ; je lui dis TOUT CE QUE JE VIENS DE VOUS écrire ; et ce qui regardait ,"imera cette femme là. Mais de TOUT CE QUE JE VIENS DE VOUS citer, rien n'a été sérieux q","(74277, 74305)","(46147, 46181)"
Dorat_Sacrifices_0," et les journées se passent à MESURER DES YEUX LA HAUTEUR DES MURS. 
---Madame, je ne saurais le"," distance de cette prison, et MESURE DES YEUX LA HAUTEUR DES MURS qui la défendent. Cet aspect,","(203078, 203114)","(320727, 320762)"
Dorat_Sacrifices_1," ; je frissonne, je tremble ; UNE SUEUR FROIDE SE RÉPAND SUR TOUT MON CORPS ; JE veux aller à votre secours ; ","que je connus l'effroi. Alors UNE SUEUR FROIDE SE RÉPAND SUR TOUT MON CORPS, JE crus que j'allois expirer. Mo","(285820, 285870)","(320727, 320762)"
Duclos_Acajou_0,"l'intérêt que vous y prenez. 
VOTRE TRÈS-HUMBLE ET TRÈS-OBÉISSANT SERVITEUR. 
À Caen, ce 17 février 1760.","s en exigez d'autres, je suis VOTRE TRÈS-HUMBLE ET TRÈS-OBÉISSANT SERVITEUR. 
ACAJOU ET ZIRPHILE CONTE. 
","(398173, 398218)","(2897, 2942)"
Dulaurens_Imirce_0,"uelque chose de pointu ; » et LEVANT LES YEUX ET LES MAINS AU CIEL, j'ajoutai en versant un torr","isa, étant sur ma bergère, d'éLEVER LES YEUX ET LES MAINS AU CIEL, en s'écriant avec enthousias","(174240, 174276)","(230936, 230971)"
Fievee_Dot_0,"e ? 
--- Que... 
---Achevez ; JE FERAI TOUT CE QUI DÉPENDRA DE MOI. » Elle hésita, se couvrit le","me, était son unique réponse. JE FERAI TOUT CE QUI DÉPENDRA DE MOI pour être heureuse; et, si je","(250802, 250838)","(50514, 50550)"
Florian_Estelle_0,"nous étions venues au monde à PEU DE DISTANCE LES UNES DES AUTRES, nous devînmes grandes tous l"," pierres posées dans l'eau, à PEU DE DISTANCE LES UNES DES AUTRES, étaient le seul chemin pour ","(22054, 22089)","(63410, 63445)"
Florian_Galatee_0,osais la regarder. Je ne sais CE QUI SE PASSAIT DANS MON ÂME ; MAIS TOUT à coup je me jetai à ses pied,t aisé de lire sur mon visage CE QUI SE PASSAIT DANS MON ÂME; MAIS TOUT le monde était occupé de l'ét,"(47695, 47737)","(35371, 35412)"
Fourqueux_Zely_0,"re Séraphin, vous savez enfin QUI VOUS ÊTES, ET CE QUE VOUS pouvez attendre de moi, si vo","usante. Apprenez moi d'abord “QUI VOUS ÊTES ET CE QUE VOUS cherchez ici.--Mon récit, rép","(58197, 58226)","(22003, 22031)"
