,Text in Diderot_Religieuse,Text in B,Location in Diderot_Religieuse,Location in B
Genlis_Adele_0,"uelque chose de pointu ; » et LEVANT LES YEUX ET LES MAINS AU CIEL, J'AJOUTAI EN VERSANT UN TORRENT DE LARMES : « C'est qu'on m'a blessée a","ersoient sur leurs chaises en LEVANT LES YEUX ET LES MAINS AU CIEL, ET LA PLUS JEUNE DE TOUTES FUT SI VIVEMENT AFFECTÉE AU TROISIÈME ACTE, QU'ELLE SE TROUVA MAL TOUT-À-FAIT. MADAME DE SURVILLE, QUI ÉTAIT ELLE-MÊME DANS UN ÉTAT AFFREUX, LA SECOURUT ET FUT OBLIGÉE DE LA DÉLACER. LE VICOMTE, ACCOUTUMÉ SANS DOUTE À PRODUIRE DE PAREILS EFFETS, NE FIT QU'EN SOURIRE, ET CONTINUA SA LECTURE. LE RESTE DE L'OUVRAGE EUT LE MÊME SUCCÈS; ET, MOI, N'ENTENDANT RIEN QUE LES ÉLOGES QU'ON Y DONNAIT, VOUS IMAGINEZ AISÉMENT CE QUE JE DÛ SOUFFRIR. AU DÉSESPOIR DE NE POUVOIR PARTAGER LES TRANSPORTS QUE JE VOYAIS ÉCLATER, J'ÉPROUVAIS VÉRITABLEMENT LE SUPPLICE DE TANTALE. LORSQUE LA LECTURE FUT ACHEVÉE, TOUTES LES FEMMES SE LEVÈRENT ET ENTOURÈRENT LE VICOMTE. 
LEURS GESTES PASSIONNÉS, LE TON PERÇANT DE LEURS VOIX, LA VOLUBILITÉ DE LEURS DISCOURS, PEIGNAIENT PARFAITEMENT L'ENTHOUSIASME DONT ELLES ÉTAIENT SAISIES. POUR MOI, QUI N'AVAIS RIEN À DIRE, PUISQUE JE N'AVAIS RIEN ENTENDU, J'ÉTAIS FORT EMBARASSÉ DE MA CONTENANCE; ET N'OSANT ME PRÉSENTER DEVANT LE VICOMTE AVEC UN VISAGE FROID ET DES YEUX SECS, JE M'ÉCHAPPAI TOUT DOUCEMENT DU SALON ET J'ENTRAI DANS LE CABINET DE MADAME DE SURVILLE, AVEC LE PROJET D'Y RESTER JUSQU'À CE QUE LE VICOMTE FÛT SORTI. 
MAIS J'ÉTAIS DESTINÉ, COMME VOUS L'ALLEZ VOIR, À NE RENCONTRER, DANS CETTE JOURNÉE, QUE DES OBJETS INATTENDUS ET SURPRENANT. LA PREMIÈRE CHOSE QUI ME FRAPPA EN POSANT LE PIED DANS LE CABINET, CE FUT UN BUREAU COUVERT DE PAPIERS ET DE LIVRES. COMMENT, DIS-JE, UN BUREAU CHEZ UNE FEMME, ET CHEZ MADAME DE SURVILLE! MAIS, CONTINUAI-JE, PUISQUE VOILÀ DES LIVRES, JE NE M'ENNUYERAI PAS TANT SEUL: LISONS. À L'INSTANT J'EN PRENDS UN, JE L'OUVRE, C'ÉTAIT UN TRAITÉ DE CHIMIE : COMME JE NE SUIS POINT CHIMISTE, J'EN CHOISIS UN AUTRE, C'ÉTAIT UN TRAITÉ DEPHYSIQUE : LE TROUVANT ENCORE TROP ABSTRAIT POUR MOI, J'EN PRENDS UN TROISIÈME: HÉLAS! MON CHER BARON, C'ÉTAIT UN DICTIONNAIRE D'HISTOIRE NATURELLE . CONFUS ET HUMILIÉ, JE VOUS L'AVOUE, DE NE POUVOIR TROUVER CHEZ UNE FEMME ET CHEZ MADAME DE SURVILLE, UN SEUL LIVRE QUI FUT À MA PORTÉE, JE ME LEVAI ET M'ÉLOIGNAI DU BUREAU AVEC UN PEU D'HUMEUR. MES REGARDS SE PORTÈRENT SUR UN PETIT MORCEAU DE SCULPTURE QUI SE TROUVAIT À CÔTÉ DE MOI. C'ÉTAIT UN AUTEL ÉLEVÉ À LA BIENFAISANCEET ORNÉ DE VERS SUR LA BIENFAISANCE , QUI ME PARURENT REMPLIS DE SENTIMENT. 
EN ME RETOURNANT, J'APERÇU UN AUTRE GROUPE EN MARBRE PLUS INTÉRESSANT ENCORE, JE M'EN APPROCHAI, C'ÉTAIT UN AUTEL À L'AMITIÉ , ET UNE FIGURE, QUE JE RECONNUS POUR ÊTRE CELLE DEMADAME DE SURVILLE, Y POSAIT UNE COURONNE. EH, MON DIEU! M'ÉCRIAI-JE, J'APPRÉCIAIS BIEN MAL MADAME DE SURVILLE; J'ÉTAIS BIEN ÉLOIGNÉ DE LA CROIRE AUSSI SAVANTE, AUSSI SENSIBLE, AUSSI SPIRITUELLE... SA MODESTIE LUI FAIT CACHER TANT D'AVANTAGES; CAR À LA VOIR, À L'ENTENDRE, QUI SE DOUTERAIT QU'ELLE LES POSSÈDE! COMME J'ACHEVOIS CETTE EXCLAMATION, LA PORTE DU CABINET S'OUVRIT, ET JE VIS PARAÎTRE UN GROS HOMME VÊTU DE NOIR, QUE J'AVAIS DÉJÀ VU À LA LECTURE, ET QUE J'AVAIS MÊME REMARQUÉ ÊTRE LE SEUL, APRÈS MOI, QUI N'EÛT NI PLEURÉ, NI LOUÉ. IL AVAIT L'AIR CHAGRIN ET DE MAUVAISE HUMEUR, CEPENDANT NOUS ENTRÂMES EN CONVERSATION. CE CABINET EST CHARMANT, LUI DIS-JE, ET SUR-TOUT PAR L'IDÉE QU'IL DONNE DE CELLE QUI L'OCCUPE. ICI L'HOMME VÊTU DE NOIR HAUSSA LES ÉPAULES, EN ME DISANT: D'OÙ VENEZ-VOUS DONC, MONSIEUR?-DE MOSCOU, MONSIEUR.-DE MOSCOU! OH BIEN, VOUS ÊTES MON HOMME; ÉCOUTEZ-MOI, JE VAIS VOUS INSTRUIRE. CE CABINET, QUE VOUS CROYEZ BONNEMENT UN TEMPLE CONSACRÉ À L'AMITIÉ, À L'ÉTUDE ET À LA MÉDITATION , N'EST QU'UN LIEU DE PARADE; TOUS CES LIVRES ÉTALÉS-LÀ SUR CE BUREAU, N'Y SONT QUE POUR L'ORNEMENT, COMME DES PORCELAINES SUR UNE CHEMINÉE. MOLIÈRE A PEINT LES FEMMES SAVANTES DE SON SIÈCLE, QUI ÉTAIENT EN EFFET FORT RIDICULES, MAIS QUI DU MOINS SAVAIENT QUELQUE CHOSE; AU LIEU QUE LES NÔTRES JOIGNENT LES PLUS GRANDES PRÉTENTIONS À LA PLUS PROFONDE IGNORANCE. À CE DISCOURS, JE ME DOUTAI QUE L'HOMME AUQUEL J'AVAIS AFFAIRE, ÉTAIT UN ORIGINAL, UNE ESPÈCE DE FOU CAUSTIQUE ET BIZARRE, ET JE NE ME TROMPAI POINT DANS CETTE CONJECTURE. MAIS, MONSIEUR, RÉPONDIS-JE, LES FEMMES D'AUJOURD'HUI CULTIVENT LES SCIENCES, IL EST VRAI; MAIS ON NE PEUT LES ACCUSER DE PÉDANTERIE, ELLES N'EMPLAIENT POINT D'EXPRESSIONS SCIENTIFIQUES, ELLES N'ÉTALENT POINT CE QU'ELLES SAVENT...-MAIS, MONSIEUR, ENCORE UNE FOIS, ELLES NE SAVENT RIEN; L'ESPÈCE DE PÉDANTERIE DONT VOUS PARLEZ, SUPPOSE AU MOINS QUELQUES CONNAISSANCES, TANDIS QU'IL N'EN FAUT AUCUNE POUR ALLER VOIR DES EXPÉRIENCES D'ÉLECTRICITÉ, POUR DIRE QU'ON FAIT UN COURS DE CHIMIE, ET QU'ON S'Y AMUSE INFINIMENT; ENFIN, POUR ÉCOUTER D'UN AIR CAPABLE, ET DE TEMPS EN TEMPS HASARDER UN PETIT MOT QUI DÉCOUVRE BIEN CLAIREMENT QU'ON NE SAIT RIEN. ELLES ONT PRESQUE TOUTES REÇU L'ÉDUCATION LA PLUS NÉGLIGÉE; AUSSI-TÔT QU'ELLES SONT LEURS MAÎTRESSES, ELLES NE LISENT QUE DE MAUVAISES BROCHURES ET DES DRAMES QUI ACHÈVENT DE LEUR GÂTER LE GOÛT, ELLES MÈNENT LA VIE LA PLUS DISSIPÉE, ET ELLES PRÉTENDENT À LA SCIENCE UNIVERSELLE. ELLES SE CONNAISSENT EN TABLEAUX, EN ARCHITECTURE; ELLES SONT GLUKISTES OU PICCINISTES , SANS SAVOIR UN MOT DE COMPOSITION; ELLES FONT DES COURS, MONTENT À CHEVAL, JOUENT AU BILLARD, VONT À LA CHASSE, CONDUISENT DES CALÈCHES, PASSENT LES NUITS AU BAL ET AU PHARAON, ÉCRIVENT AU MOINS DIX BILLETS PAR JOUR, REÇOIVENT CENT VISITES, SE MONTRENT PAR-TOUT. ON LES VOIT SUCCESSIVEMENT, DANS L'ESPACE DE DOUZE HEURES, À VERSAILLES, À PARIS, CHEZ UN MARCHAND, À UNE AUDIENCE DE MINISTRE, AUX PROMENADES, DANS UN ATELIER DE SCULPTEUR, À LA FOIRE, À L'ACADÉMIE, À L'OPÉRA, AUX DANSEURS DE CORDE, APPLAUDISSANT ET GOÛTANT ÉGALEMENT PRÉVILLE ET JEANNOT , D'AUBERVAL ET LE PETIT-DIABLE .COMMENT VOULEZ-VOUS, POURSUIVIT-IL, QU'EN FAISANT TANT DE CHOSES, ELLES PUISSENT JAMAIS RÉUSSIR À RIEN? CEPENDANT ELLES DÉCIDENT DESPOTIQUEMENT; ET MADAME DE SURVILLE, PAR EXEMPLE, QUI NE SENT PAS LA MESURE D'UN VERS, ET QUI NE SAIT NI SA LANGUE NI L'ORTHOGRAPHE, N'EN JUGE PAS MOINS LES OUVRAGES DE LITTÉRATURE, ET S'IMAGINE QUE LES LETTRES QU'ELLE ÉCRIT À SES AMIS PASSERONT UN JOUR À LA POSTÉRITÉ, COMME CELLES DE MADAME DE SÉVIGNÉ. POUR LEUR SENSIBILITÉ; IL EST VRAI QU'ELLES ONT DES AJUSTEMENT DE CHEVEUX, DES GALERIES DE PORTRAITS, DES AUTELS À L'AMITIÉ, DES HYMNES À L'AMITIÉ . IL EST VRAI QU'ELLES NE BRODENT PLUS QUE DES CHIFFRES , QU'ELLES NE PARLENT PLUS QUE DE SENTIMENT, DE BIENFAISANCE ET DES CHARMES DE LA SOLITUDE , ET QU'ELLES SONT TOUTES ESPRITS-FORTS . 
MAIS VIVENT-ELLES PLUS RETIRÉES QUE LES FEMMES D'AUTREFOIS? S'OCCUPENT-ELLES DAVANTAGE DE L'ÉDUCATION DE LEURS ENFANTS? SONT-ELLES PLUS ESSENTIELLES, PLUS SENSIBLES, PLUS AIMABLES QUE LESDESHOULIÈRES, LES SÉVIGNÉ, LES GRAFIGNI? ONT-ELLES MOINS DE LUXE, MOINS DE FANTAISIES, DEPUIS QU'ELLES SONT DEVENUES SI PHILOSOPHES ET SI BIENFAISANTES ? ... ON POURRAIT COMPARER CES TRAVERS À CEUX DES FAUSSES DÉVOTES, DONT TOUTE LA RELIGION NE CONSISTE QU'EN PETITES PRATIQUES EXTÉRIEURES; QUI ONT UN ORATOIRE ET DES RELIQUES, QUI PRIENT LES SAINTS SANS AIMER DIEU, QUI SERMONENT SANS SE CORRIGER, ET QUI BLÂMENT AVEC AUTANT D'EMPORTEMENT QUE D'AIGREUR CEUX QUI NE LES IMITENT PAS. 
PENDANT TOUT CE DISCOURS, MON CHER BARON, J'ÉTAIS RESTÉ DEBOUT, IMMOBILE D'ÉTONNEMENT ET D'INDIGNATION; ENFIN, JE ROMPIS LE SILENCE, ET JE DIS D'UN TON RAILLEUR: LES FEMMES, MONSIEUR, SONT BIEN À PLAINDRE; ELLES ONT EN VOUS UN ENNEMI BIEN ÉLOQUENT ET BIEN DANGEREUX. MOI, LEUR ENNEMI! INTERROMPIT-IL VIVEMENT; AH, QUE VOUS ME JUGEZ MAL!NATURELLEMENT JE LES ESTIME ET JE LES AIME.-VOUS LES AIMEZ, MONSIEUR, JE NE M'EN SERAIS PAS DOUTÉ.-OUI, JE LES AIME, ET BEAUCOUP PLUS QUE CEUX QUI LES ENCENSENT ET QUI LES FLATTENT... EN EFFET, MONSIEUR, REPRIS-JE, ELLES NE POURRONT VOUS ACCUSER NI D'ADULATION NI DE FADEUR.-JE NE HAIS EN ELLES, RÉPLIQUA-T-IL, QUE CE QUI NE LEUR APPARTIENT PAS. AU RISQUE DE LEUR DÉPLAIRE, JE VOUDRAIS POUVOIR LES ÉCLAIRER SUR LEURS VRAIS INTÉRÊTS. 
ELLES SONT FAITES POUR SÉDUIRE, POUR INTÉRESSER, POUR CHARMER; ELLES TIENNENT DE LA NATURE DES GRÂCES SIMPLES ET TOUCHANTES; ELLES LUI DOIVENT EN GÉNÉRAL UN GENRE D'ESPRIT PLUS FIN, PLUS DÉLICAT QUE LE NÔTRE. QUAND ELLES SE DONNERONT LE TEMPS DE RÉFLÉCHIR ET DE PENSER, QUAND ELLES NE PRÉFÉRERONT PAS À DES QUALITÉS PRÉCIEUSES ET NATURELLES, DES PRÉTENTIONS VAINES ET RIDICULES, LEUR SOCIÉTÉ SERA LA PLUS AGRÉABLE DE TOUTES, ELLES POURRONT JUGER SAINEMENT DE TOUS LES OUVRAGES DE GOÛT, ET LEUR SUFFRAGE DEVIENDRA LA RÉCOMPENSE DES TALENTS.OSERAI-JE, MONSIEUR, VOUS FAIRE UNE QUESTION? VOUS ÊTES, DITES-VOUS, PARTISAN ZÉLÉ DES FEMMES, ET VOUS VOUS DÉCHAÎNEZ CONTRE ELLES; IL ME SEMBLE QUE DANS VOTRE PREMIER DISCOURS, VOUS AVEZ DIT DU MAL DES DRAMES; MAIS SANS DOUTE QUE VOUS NE LES EN AIMEZ PAS MOINS.-CE N'EST PAS LA MÊME CHOSE, RÉPONDIT-IL, CAR JE SUIS IRRÉCONCILIABLE AVEC LES DRAMES, SUR-TOUT DEPUIS DEUX OU TROIS ANS; AVANT CE TEMPS, JE PRENAIS PATIENCE, ET J'EN ÉTAIS QUITTE POUR NE PLUS ALLER À LA COMÉDIE QUE LES PETITS JOURS , C'EST-À-DIRE, CEUX OÙ L'ON NE JOUE QUE DE BONNES PIÈCES. MAIS LES DRAMES À PRÉSENT POURSUIVENT PAR-TOUT; JE LES AI RETROUVÉS DANS LE MONDE, DANS LA SOCIÉTÉ, DANS MA FAMILLE. COMME IL N'Y A PERSONNE QUI NE SOIT EN ÉTAT DE METTRE EN DIALOGUE UN ROMAN OU QUELQUE ANECDOTE PARTICULIÈRE, QUE CES SORTES DE PRODUCTIONS N'EXIGENT NI TALENT, NI CONNAISSANCE DU CŒUR HUMAIN, NI ÉTUDE DU THÉÂTRE, TOUT LE MONDE S'EST MIS À FAIRE DES DRAMES; ET MOI QUI VOUS PARLE, J'AI DEUX SŒURS QUI FONT DES DRAMES AVEC LA MÊME FACILITÉ QU'ELLES FAISAIENT DES BOURSES IL Y A DEUX ANS.-JE CROYAIS, DIS-JE, QUE LES DRAMES ÉTAIENT UN PEU TOMBÉS.-POINT DU TOUT, RÉPLIQUA-T-IL; CEPENDANT, COMME ON LES A FORT RIDICULISÉS, LE MOT EST PROSCRIT; MAIS LE GENRE ÉTANT TRÈS-COMMODE, IL SUBSISTE TOUJOURS. ON FAIT PLUS QUE JAMAIS DES DRAMES, ET ON LEUR DONNE CE VIEUX TITRE DE COMÉDIE , QUI VÉRITABLEMENT S'ANNONCE ET PROMET BEAUCOUP MIEUX. 
QUOI, MONSIEUR! CE QU'ON NOUS A LU AUJOURD'HUI ÉTAIT UN DRAME? ... MAIS DE BONNE-FOI, RÉPONDIT-IL, PENSEZ-VOUS QU'UN HOMME DU MONDE QUI A LES DEVOIRS DE SON ÉTAT À REMPLIR, QUI, QUOIQUE AUTEUR, N'A RENONCÉ NI À LA GALANTERIE, NI À L'AMBITION, NI AU JEU, NI AUX SOUPERS PRIÉS, PUISSE TROUVER LE TEMPS NÉCESSAIRE POUR FAIRE UNE PIÈCE PASSABLE? POURQUOI, DANS LE SIÈCLE DE MOLIÈRE, LES GENS DU MONDE N'AVAIENT-ILS PAS CETTE FUREUR D'ÉCRIRE? C'EST QUE LE DRAME N'ÉTAIT PAS NÉ, C'EST QU'IL FAUT DU GÉNIE ET UNE PROFONDE ÉTUDE POUR ÊTRE EN ÉTAT DE FAIRE UNE BONNE COMÉDIE, ET QU'IL NE FAUT NI L'UN NI L'AUTRE POUR PRODUIRE UN ASSEMBLAGE INFORME DE PETITS FAITS ROMANESQUES ET REBATTUS, SANS PLAN, SANS CARACTÈRES, SANS VÉRITÉ: ENFIN, SI MOLIÈRE LUI-MÊME EÛT ÉTÉ MAGISTRAT, MILITAIRE OU COURTISAN, IL N'EÛT POINT DONNÉ D'OUVRAGES DE THÉÂTRE; OU SI CETTE CARRIÈRE L'EÛT TENTÉ, MALGRÉ TOUT SON GÉNIE, IL N'AURAIT CERTAINEMENT FAIT NI LE MISANTROPE NI LE TARTUFE. QUE PRODUIT CETTE PRÉTENTION UNIVERSELLE À L'ESPRIT QUI NOUS A GAGNÉ TOUS? LA MOITIÉ DES GENS DU MONDE ÉCRIT, ET LIT À L'AUTRE MOITIÉ, QUI, SÉDUITE PAR CETTE CONFIANCE, APPROUVE AVEUGLÉMENT. IL FAUT CROIRE QUE TOUTES CES PRODUCTIONS SONT PARFAITES, CAR JE N'AI PAS ENCORE VU TOMBER UN OUVRAGE DE SOCIÉTÉ, LES AUDITEURS SONT TOUJOURS CONTENT, ET LE SUCCÈS DE CES LECTURES EST TOUJOURS CERTAIN. LES GENS DU MONDE CEPENDANT JUGENT LES VRAIS AUTEURS, ET N'APPROUVENT GUÈRE QUE CE QU'ILS SONT CAPABLES ET SUSCEPTIBLES D'IMITER; CE QUI CONDUIT INSENSIBLEMENT À LA PERTE DU GOÛT: CELA EST SI VRAI, QUE LA PLUPART DES OUVRAGES, FRUITS HEUREUX DU SIÈCLE DE LOUIS-LE-GRAND, NE SONT PRESQUE PLUS APPRÉCIÉS AUJOURD'HUI; ET SI TÉLÉMAQUE ET LES POËSIES DE MADAME DESHOULIÈRES ÉTAIENT DES PRODUCTIONS NOUVELLES, ON LES TROUVERAIT INSIPIDES. NOUS NE POUVONS PLUS SENTIR LES BEAUTÉS D'UN PLAN SIMPLE ET PROFOND, D'UN STYLE NATUREL ET PUR; ET DES VERS PLEINS DE DOUCEUR, D'HARMONIE ET DE SENTIMENT, MAIS DÉNUÉS DE TRAIT ET DE MÉTAPHYSIQUE , NE NOUS PAROÎTROIENT PLUS QUE FADES ET ENNUYEUX. 
IMPATIENTÉ, MON CHER BARON, DE TOUTES CES FOLLES DÉCLAMATIONS, J'INTERROMPIS ENCORE MON RIGIDE CENSEUR, ET JE LUI DIS AVEC VIVACITÉ: IL NE S'AGIT POINT, MONSIEUR, DES IDYLLES ET DES MOUTONS DE MADAME DESHOULIÈRES; REVENONS AUX NÔTRES, S'IL VOUS PLAÎT, ET DITES-MOI CE QUE VOUS PENSEZ DE LA PIÈCE DU VICOMTE? ... JE NE PUIS, DIT-IL, VOUS PARLER QUE DU PREMIER ACTE, CAR LES QUATRE AUTRES M'ONT LIVRÉ AU PLUS PROFOND SOMMEIL QUE J'AURAI JAMAIS DE MA VIE. MONSIEUR, REPRIS-JE AVEC BEAUCOUP D'IRONIE, VOILÀ UNE CRITIQUE BIEN NEUVE ET BIEN PIQUANTE.-HÉLAS! CE N'EST POINT UNE CRITIQUE, JE VOUS ASSURE, C'EST LA VÉRITÉ. J'AI BEAUCOUP DE CONFIANCE EN VOS LUMIÈRES, RÉPLIQUAI-JE; CEPENDANT J'AI VU SOIXANTE PERSONNES S'EXTASIER ET FONDRE EN LARMES, JE NE VOIS QUE VOUS DE MÉCONTENT: AINSI, MONSIEUR, VOUS ME PERMETTREZ D'EN CONCLURE QUE VOTRE JUGEMENT POURRAIT BIEN N'ÊTRE PAS LE BON: D'AILLEURS, JE ME FLATTE QUE LE VICOMTE FERA BIENTÔT IMPRIMER SA PIÈCE, ET ALORS PEUT-ÊTRE QUE L'OPINION DU PUBLIC... SE FAIRE IMPRIMER! INTERROMPIT-IL; Y PENSEZ-VOUS? UN HOMME DE LA SOCIÉTÉ SE FAIRE IMPRIMER! FI DONC, CE SERAIT S'AFFICHER ET SE DONNER UN RIDICULE AFFREUX.-MAIS, MONSIEUR, QUAND ON LIT SA PIÈCE À SOIXANTE PERSONNES, ON EST AU-DESSUS DE CES PRÉJUGÉS.-MAIS, MONSIEUR, J'AI L'HONNEUR DE VOUS DIRE QU'IL EST TOUT SIMPLE DE LIRE SES OUVRAGES À SES AMIS, À CENT PERSONNES, ET NON DE LES FAIRE IMPRIMER.-MAIS, MONSIEUR, POURQUOI?-AH! POURQUOI, REPRIT-IL EN SOURIANT, C'EST QUE NOUS AVONS TOUJOURS AU FOND DU CŒUR UN INSTINCT SECRET, QUI, MALGRÉ LES FAUX JUGEMENT ET LES VAINS ÉLOGES, NOUS AVERTIT QUAND NOUS FAISONS MAL; ET CE SENTIMENT INTÉRIEUR D'UNE MAUVAISE CONSCIENCE, EMPÊCHERA LE VICOMTE DE SE FAIRE IMPRIMER. COMME IL ACHEVAIT CES MOTS, JE SENTIS QUE JE N'ÉTAIS PLUS LE MAÎTRE DE ME CONTENIR DAVANTAGE; ET NE VOULANT POINT CÉDER À MON IMPATIENCE, JE LE QUITTAI BRUSQUEMENT. JE FUS REJOINDRE MADAME DE SURVILLE, QUE JE TROUVAI SEULE ET À SA TOILETTE; ELLE ME CROYAIT PARTI, ET FUT SURPRISE DE ME VOIR; JE LUI CONTAI CE QUI VENAIT DE M'ARRIVER; ET, COMME VOUS L'IMAGINEZ BIEN, JE N'ÉPARGNAI PAS LE CENSEUR IMPITOYABLE QUI M'AVAIT EXCÉDÉ SI LONG-TEMPS.-C'EST UN MISANTROPE, ME DIT MADAME DE SURVILLE, ENNUYEUX À LA MORT; IL EST PESANT , ENTÊTÉ, REMPLI D'HUMEUR, ET D'AILLEURS N'A PAS LE SENS COMMUN . MAIS, AJOUTA-T-ELLE EN SE LEVANT, IL FAUT QUE JE SORTE; QUAND VOUS REVERRAI-JE?-DEMAIN MATIN, MADAME, SI VOUS LE PERMETTEZ. AH! DEMAIN, CELA N'EST PAS POSSIBLE. JE VAIS À L'ACADÉMIE ENTENDRE LE DISCOURS DE RÉCEPTION DE MON FRÈRE.-COMMENT, LE MARQUIS DE SOLANGES EST REÇU À L'ACADÉMIE FRANÇAISE?-OUI, ET JE VOUS ASSURE QU'IL N'A PAS BRIGUÉ CET HONNEUR; VOUS CONNAISSEZ SA MANIÈRE D'ÊTRE ; ON NE L'ACCUSERA PAS D'AVOIR DES PRÉTENTIONS, IL EST D'UNE SIMPLICITÉ! ... JE CROIS QUE VOUS SEREZ CONTENT DE SON DISCOURS.-EH BIEN, MADAME, REPRIS-JE EN LUI DONNANT LA MAIN, DEMAIN DANS L'APRÈS-DÎNER... NON, RÉPONDIT-ELLE, J'AURAI MON MAÎTRE DE LANGUE ANGLAISE. MERCREDI, L'AUTEUR DE LA PIÈCE NOUVELLE M'A PRIÉE D'ALLER À UNE RÉPÉTITION.JEUDI, JE VAS CHEZ GREUZE VOIR SA DANAÉ. VENDREDI, J'IRAI VOIR DES EXPÉRIENCES SUR L'AIR FIXE; MAIS SAMEDI, JE SERAI LIBRE... APRÈS M'AVOIR DONNÉ CETTE ESPÉRANCE, MADAME DE SURVILLE MONTA DANS SA VOITURE; ET MOI, CONFONDU, ENCHANTÉ DE TOUT CE QUE J'AVAIS REMARQUÉ ET VU DANS CETTE JOURNÉE, JE RENTRAI CHEZ MOI, AFIN D'Y RÉFLÉCHIR SANS DISTRACTION. À SEPT HEURES, JE FUS À LA COMÉDIE FRANÇAISE, DANS LA LOGE DE MADAME DE SEMUR; JE LA TROUVAI PRÊTE À SORTIR AU MOMENT OÙ LE CINQUIÈME ACTE DE RODOGUNE ALLAIT COMMENCER, ET ELLE ME DIT QU'ELLE ALLAIT VOIR JOUER LES BATTUS PAYENT L'AMENDE , AINSI QUE TROIS OU QUATRE PERSONNES QUI ÉTAIENT AVEC ELLE. JE DEMANDAI SI CETTE PIÈCE ÉTAIT UN DRAME; À CETTE QUESTION, TOUT LE MONDE S'ÉCRIA: COMMENT, VOUS NE CONNAISSEZ PAS LES BATTUS PAYENT L'AMENDE? VENEZ, VENEZ, VOUS ALLEZ ÊTRE CHARMÉ. À CES MOTS, ON M'EMMENA, ET L'ON ME CONDUISIT DANS UNE FORT VILAINE SALLE, MAIS DANS LAQUELLE NOUS TROUVÂMES LA MEILLEURE COMPAGNIE DE PARIS. ON JOUA D'ABORD UNE PETITE PIÈCE FORT AGRÉABLE, QUI A POUR TITRE, LE CAFÉ DES HALLES; J'AVOUE QUE JE N'EN PUS SAISIR TOUTES LES PLAISANTERIES, PARCE QUE LE LANGAGE EN ÉTAIT ABSOLUMENT NOUVEAU POUR MOI.CEPENDANT, JE SENTIS BIEN QUE L'ACTRICE QUI REPRÉSENTAIT LA PRINCIPALE POISSARDE, AVAIT DES INFLEXIONS TRÈS-NATURELLES, ET JOUAIT SUPÉRIEUREMENT; MAIS LES BATTUS PAYENT L'AMENDE ME CONFONDIRENT VÉRITABLEMENT; LE POT-DE-CHAMBRE JETÉ SUR JEANNOT, LE HÉROS DE LA PIÈCE, PRODUIT UN DES EFFETS DE THÉÂTRE DES PLUS PIQUANS QUE J'AIE ENCORE VUS; ET L'INSTANT OÙ JEANNOT SENT SA MANCHE, ET S'ÉCRIE: C'EN EST, CET INSTANT NE PEUT SE PEINDRE, ET IL EXCITA DES TRANSPORTS ET DES APPLAUDISSEMENTS QUI DURÈRENT UN QUART-D'HEURE. AUSSI, CETTE PIÈCE A-T-ELLE EU DÉJÀ CENT CINQUANTE REPRÉSENTATIONS, ET ELLE EST ENCORE AUSSI SUIVIE QUE LE PREMIER JOUR. QU'ON DISE APRÈS CELA QUE LES FRANÇAIS  SONT LÉGERS!J'AUROIS ENCORE BIEN D'AUTRES CHOSES À VOUS CONTER, MON CHER BARON, MAIS JE ME RÉSERVE LE PLAISIR DE VOUS LES DIRE MOI-MÊME, SI VOUS ME PERMETTEZ D'ALLER VOUS VOIR, ET CROYEZ QUE LES DÉTAILS QUE J'AI LA DISCRÉTION DE NE PAS CONFIER À LA POSTE, NE SONT PAS LES MOINS INTÉRESSANT NI LES MOINS CURIEUX. 
LETTRE 34 LA BARONNE À LA VICOMTESSE. ENFIN, CÉCILE EST ARRIVÉE HIER, JE L'AI TROUVÉE TELLE QUE VOUS ME L'AVEZ DÉPEINTE, AGRÉABLE ET INTÉRESSANTE AU-DELÀ DE L'EXPRESSION; ET IL EST TRÈS-VRAI QUECHARLES, SON NEVEU, LUI RESSEMBLE D'UNE MANIÈRE FRAPPANTE; TOUTE LEUR FAMILLE EST RASSEMBLÉE CHEZ MOI POUR HUIT JOURS. JE DESIRAIS VIVEMENT ÊTRE PRÉSENTE À LA PREMIÈRE ENTREVUE DE CÉCILE ET DE SON PÈRE, ET JE N'AI JAMAIS RIEN VU QUI M'AIT AFFECTÉE DAVANTAGE. M D'AIMERI CRAIGNAIT ET DESIROIT ÉGALEMENT CET INSTANT; IL SE LEVA HIER AVANT LE JOUR; ET LORSQU'IL ENTRA CHEZ MOI, JE M'APERÇU FACILEMENT, À L'ALTÉRATION DE SON VISAGE, QU'IL AVAIT PASSÉ UNE CRUELLE NUIT. APRÈS LE DÎNER, NOUS MONTÂMES EN VOITURE, MADAME DE VALMONT, M D'AIMERI ET MOI, POUR ALLER AU-DEVANT DE CÉCILE; M D'AIMERI ÉTAIT PÂLE, TREMBLANT, IL AVAIT L'AIR DE SOUFFRIR LA PLUS MORTELLE CONTRAINTE; IL ÉVITAIT NOS REGARDS, ET SEMBLAIT VOULOIR CACHER LE TROUBLE AFFREUX DONT IL ÉTAIT DÉVORÉ; JE VIS QU'IL REDOUTAIT AU FOND DE L'ÂME L'IMPRESSION QUE POURRAIT PRODUIRE SUR NOUS LA VUE TOUCHANTE DE SA VICTIME, ET QU'IL PENSAIT QUE LA PRÉSENCE DE CÉCILE ALLAIT DÉTRUIRE TOUTE LA COMPASSION QU'IL NOUS AVAIT INSPIRÉE. TANT QU'ON PEUT SE FLATTER D'INTÉRESSER VIVEMENT EN LAISSANT VOIR SES REMORDS, ON EN PARLE AVEC FRANCHISE; MAIS ON NE CHERCHE PLUS QU'À LES DISSIMULER, QUAND ON A PERDU CET ESPOIR. ON SE PERSUADE ALORS QU'EN LES CACHANT, ON DIMINUE AUX YEUX DES AUTRES UNE PARTIE DE SES FAUTES. NOUS AVIONS À PEINE FAIT DEUX LIEUES, LORSQUE TOUT-À-COUP MADAME DE VALMONT, APERCEVANT DE LOIN UNE VOITURE, S'ÉCRIA: VOILÀ MA SŒUR! M D'AIMERI PÂLIT ET ROUGIT; ET VOYANT QUE MADAME DE VALMONT PLEURAIT, IL LUI DIT AVEC UNE COLÈRE CONCENTRÉE ET UNE VOIX TREMBLANTE: EH BIEN, MADAME, ALLEZ-VOUS FAIRE UNE SCÈNE? SURPRISE DE SA SÉVÉRITÉ, ET PLUS ENCORE DE SON AIR ÉGARÉ, SOMBRE ET FAROUCHE, MADAME DE VALMONT ESSUYA SES PLEURS SANS POUVOIR COMPRENDRE LA RAISON D'UN SEMBLABLE CAPRICE. CEPENDANT, LA VOITURE QUE NOUS AVIONS VUE, S'APPROCHE ET S'ARRÊTE, JE TIRE LE CORDON DE LA MIENNE; M D'AIMERI, POUVANT À PEINE SE SOUTENIR, DESCEND; DANS CE MOMENT, J'ENTENDS UN CRI TOUCHANT, QUI SANS DOUTE RETENTIT JUSQU'AU FOND DE L'ÂME DE M D'AIMERI; ET PRESQUE AU MÊME INSTANT, CÉCILE, LA CHARMANTE CÉCILE PARAÎT, S'ÉLANCE VERS SON PÈRE, ET TOMBE ÉVANOUIE DANS SES BRAS. À CE SPECTACLE, M D'AIMERI NE VOIT PLUS DANS L'UNIVERS QUE CÉCILE, IL OUBLIE JUSQU'À SES REMORDS, LA NATURE REPREND TOUS SES DROITS DANS SON CŒUR, UN DÉLUGE DE LARMES INONDE SON VISAGE; IL APPELLE SA FILLE PAR LES PLUS TENDRES NOMS, IL LA PRESSE CONTRE SON SEIN, SES GENOUX TREMBLENT ET FLÉCHISSENT SOUS LUI, IL EST PRÊT À PERDRE LUI-MÊME L'USAGE DE SES SENS; MADAME DE VALMONT ET MOI, NOUS VOULONS L'AIDER À SUPPORTER CÉCILE, IL NOUS REPOUSSE, IL ARRACHE DES MAINS DE MADAME DE VALMONT LE FLACON QU'ELLE FAIT RESPIRER À SA SŒUR, IL VEUT SEUL LA SOIGNER, IL ÉPIE L'INSTANT OÙ ELLE OUVRIRA LES YEUX, IL ÉCARTE TOUT CE QUI S'APPROCHE D'ELLE, IL SEMBLE CRAINDRE ENFIN QU'ON NE LUI DÉROBE LE PREMIER REGARD DE CÉCILE... JE N'ENTREPRENDRAI POINT DE VOUS DÉPEINDRE LA SCÈNE TOUCHANTE QUI SUIVIT CELLE-CI, LORSQUE CÉCILEREPRIT SA CONNAISSANCE: C'EST UN TABLEAU QUE VOUS VOUS REPRÉSENTEREZ SÛREMENT MIEUX QUE JE NE POURRAIS VOUS LE TRACER. VOUS CONCEVREZ FACILEMENT LA JOIE, LES TRANSPORTS DECÉCILE, EN SE TROUVANT ENTRE SON PÈRE ET SA SŒUR, LE PROFOND ET DOULOUREUX ATTENDRISSEMENT DE M D'AIMERI, LA SENSIBILITÉ DE MADAME DE VALMONT, L'INTÉRÊT QUE M'INSPIRAIENT CES TROIS PERSONNES, ET LA CURIOSITÉ AVEC LAQUELLE J'OBSERVOIS TOUS LEURS MOUVEMENT. J'AI SUR-TOUT ADMIRÉ LA DÉLICATESSE DE NOTRE AIMABLE CÉCILE; ELLE LIT SANS DOUTE AU FOND DU CŒUR DE SON MALHEUREUX PÈRE, ET VOIT AISÉMENT LES REMORDS DONT IL EST DÉCHIRÉ; ET DEPUIS HIER ELLE N'EST OCCUPÉE QU'À LE CONSOLER INDIRECTEMENT, EN MONTRANT LA PLUS GRANDE GAIETÉ, EN PARLANT DE SON GOÛT POUR LA SOLITUDE; GOÛT, DIT-ELLE, FORTIFIÉ ENCORE PAR TOUT CE QU'ELLE A PU ENTREVOIR DU MONDE; ENFIN, EN FAISANT L'ÉLOGE DE SON COUVENT ET DES AMIES QU'ELLE Y A LAISSÉES. M D'AIMERI ÉCOUTE AVIDEMENT TOUS CES DISCOURS; ON VOIT QU'IL CHERCHE LUI-MÊME À SE PERSUADER DE LEUR SINCÉRITÉ, ET ALORS IL EST MILLE FOIS PLUS TENDRE POUR CÉCILE, COMME POUR LA REMERCIER DE LE JUSTIFIER À NOS YEUX ET AUX SIENS. POUR MOI, JE SUIS CONVAINCUE QUE CÉCILE EN EFFET A PRIS SON PARTI, ET QU'ELLE EST ENTIÈREMENT RÉSIGNÉE À SON SORT; CEPENDANT, ELLE N'A QUE VINGT-SEPT ANS: SI BELLE ET SI JEUNE ENCORE, AVEC UNE ÂME SI PASSIONNÉE, UNE IMAGINATION SI VIVE, COMMENT ESPÉRER QU'ELLE SOIT POUR JAMAIS À L'ABRI DE TOUTE ESPÈCE DE REGRETS! ... JE ME SUIS PROMENÉE SEULE AVEC ELLE UN MOMENT CE MATIN; NOUS PARLIONS DE CHOSES INDIFFÉRENTES, ENTRE-AUTRES, DE LA BEAUTÉ DU MOIS OÙ NOUS SOMMES; ELLE A SOUPIRÉ ET M'A DIT: AUJOURD'HUI 16 DE MAI, IL Y A DIX ANS QUE J'AI PRONONCÉ MES VŒUX. CES PAROLES ONT ÉTÉ ACCOMPAGNÉES D'UN REGARD QUI M'A PÉNÉTRÉE, SUR-TOUT LA MANIÈRE DONT ELLE A APPUYÉ SUR CES MOTS: SEIZE DE MAI! CETTE MANIÈRE AVAIT VÉRITABLEMENT QUELQUE CHOSE DE FRAPPANT ET DE TRAGIQUE. CEPENDANT, ELLE A CHANGÉ DE CONVERSATION, ET ELLE M'A SEMBLÉ REPRENDRE SUR LE CHAMP SA TRANQUILLITÉ ORDINAIRE. MAIS NOUS AVONS DÉCIDÉ, MADAME DEVALMONT ET MOI, QU'IL FALLAIT SUR-TOUT AUJOURD'HUI S'OCCUPER DE LUI PROCURER QUELQUE AMUSEMENT, AFIN DE BANNIR DE SON IMAGINATION, S'IL EST POSSIBLE, CE TERRIBLE SOUVENIR DU 16 DE MAI . EN CONSÉQUENCE, NOUS IRONS TOUS, APRÈS LE DÎNER, CHEZ NICOLE, CETTE JEUNE FERMIÈRE DONT JE VOUS AI DÉJÀ PARLÉ TANT DE FOIS: C'EST UNE DE NOS PROMENADES FAVORITES. LA MAISON DE NICOLE EST CHARMANTE PAR SA SITUATION ET LA PROPRETÉ SINGULIÈRE QU'ON Y TROUVE, ET RÉELLEMENT SON JARDIN MÉRITE D'ÊTRE VU DANS CETTE SAISON; VOUS QUI AIMEZ LES SOURCES NATURELLES, LES FLEURS ET LE GAZON, JE VOUS ASSURE QUE VOUS LE TROUVERIEZ CENT FOIS PLUS AGRÉABLE QUE TOUS LES JARDINS ANGLAIS , RENFERMÉS DANS LES MURS DE PARIS. 
MES ENFANTS SONT BIEN FIERS L'UN ET L'AUTRE DES ÉLOGES QUE VOUS DONNEZ À LEURS DESSINS, ET VOUS POUVEZ ÊTRE BIEN SÛRE QU'EN EFFET CES DEUX PETITES TÊTES N'ONT POINT ÉTÉ RETOUCHÉES PAR LEUR MAÎTRE. NOUS AVONS ÉTABLI DEPUIS CINQ OU SIX MOIS UNE PETITE ACADÉMIE DE DESSIN, QUI A SINGULIÈREMENT AUGMENTÉ L'ÉMULATION D'ADÈLE ET DE THÉODORE; UN DE NOS VOISINS, QUI NE DEMEURE QU'À UNE DEMI-LIEUE D'ICI, M'ENVOIE TOUS LES JOURS SES TROIS ENFANTS AUXQUELS DAINVILLE S'EST CHARGÉ DE MONTRER LE DESSIN; UNE PETITE FILLE D'UN DE MES GENS APPREND AUSSI, ET CHARLES VIENT À NOS LEÇONS AU MOINS TROIS FOIS PAR SEMAINE; TOUS CES ENFANTS AVEC LES MIENS TRAVAILLENT ENSEMBLE SOUS LES YEUX DE DAINVILLE, QUI DESSINE LUI-MÊME TRÈS-SÉRIEUSEMENT; NOUS AVONS, DEPUIS CET ÉTABLISSEMENT, CONSACRÉ UNE CHAMBRE À CET USAGE; LA SOCIÉTÉ A PRIS LE TITRE D'ACADÉMIE ; J'Y PRÉSIDE, ET J'EN AI COMPOSÉ LES STATUTS, QUI RECOMMANDENT PARTICULIÈREMENT L'APPLICATION, LA DOCILITÉ ET LE SILENCE . LES SÉANCES SONT PUBLIQUES; TOUT CE QUI EST DANS LE CHÂTEAU PEUT VENIR VOIR DESSINER; MAIS IL EST EXPRESSÉMENT DÉFENDU AUX ACADÉMICIENS DE REGARDER LES PERSONNES QUI ENTRENT, ET DE DIRE UN SEUL MOT. ADÈLE NE VIENDRA POINT AVEC NOUS CHEZ NICOLE, ELLE EST EN PÉNITENCE AUJOURD'HUI, ET EN VOICI LE SUJET. DAINVILLE PRÉTEND QUE MISS BRIDGET RESSEMBLE À VESPASIEN, UN DES MÉDAILLONS DE LA TAPISSERIE DE L'HISTOIRE ROMAINE. EN EFFET, LA RESSEMBLANCE EST ASSEZ FRAPPANTE, MAIS MISS BRIDGET N'A PAS GOÛTÉ CETTE PLAISANTERIE, ET S'EST MÊME FÂCHÉE TRÈS-SÉRIEUSEMENT CONTRE DAINVILLE, QUI, POUR SE VENGER, A COPIÉ L'EMPEREUR VESPASIEN SUR LA TÊTE DUQUEL IL A SEULEMENT POSÉ UN GRAND BONNET DE FEMME; CE QUI A PRODUIT UN PORTRAIT DE MISS BRIDGET SI SINGULIÈREMENT RESSEMBLANT, QU'IL A ÉTÉ RECONNU DE TOUTE LA MAISON. ADÈLE A DEMANDÉ CE DESSIN, ET L'A ATTACHÉ À SA TAPISSERIE. MISS BRIDGET, EN ENTRANT CE MATIN DANS LA CHAMBRE D'ADÈLE, A VU CE FATAL PROFIL POUR LEQUEL ELLE A TANT D'AVERSION, ELLE L'A DÉCHIRÉ EN MILLE PIÈCES; ET PRENANT ADÈLE PAR LA MAIN, ELLE L'A SUR LE CHAMP AMENÉE CHEZ MOI. ELLE ÉTAIT SI HORS D'ELLE-MÊME, ET ELLE BALBUTIAIT D'UNE SI ÉTRANGE MANIÈRE, QU'ELLE N'A PU ME FAIRE COMPRENDRE, NI EN ANGLAIS , NI EN FRANÇAIS , LE SUJET DE SA COLÈRE; JE L'AI PRIÉE DE ME LAISSER SEULE AVEC MA FILLE, ET ALORS ADÈLE M'A EXPLIQUÉ LE FAIT. APRÈS CE RÉCIT, J'AI PRIS LA PAROLE: ""ÉTAIT-CE PAR SENTIMENT POUR MISS BRIDGET, AI-JE DIT, QUE VOUS AVIEZ MIS CE DESSIN DANS VOTRE CHAMBRE? ... ""À CETTE QUESTION, ADÈLE A ROUGI, BAISSÉ LES YEUX, EN RÉPONDANT BIEN BAS: NON, MAMAN .-DANS CE CAS, C'ÉTAIT DONC PAR MALIGNITÉ.-MAIS POURQUOI MISS BRIDGET EST-ELLE SI FÂCHÉE DE RESSEMBLER À VESPASIEN QUI ÉTAIT UN SI BON EMPEREUR? VOUS M'AVEZ DIT, MAMAN, QUE TOUT CE QU'ON DISAIT SUR NOTRE FIGURE DEVAIT NOUS ÊTRE INDIFFÉRENT.-MAIS QUAND IL SERAIT VRAI QUE MISS BRIDGET EÛT CETTE FAIBLESSE, DEVRIEZ-VOUS VOUS EN MOQUER, ET LA FAIRE REMARQUER? J'AI BLÂMÉ M DAINVILLE D'AVOIR PROLONGÉ UNE PLAISANTERIE QUI ÉTAIT DÉSAGRÉABLE À MISS BRIDGET, CAR ON A DIT AVEC RAISON, QUE LA PERSONNE QUE NOUS ATTAQUONS A SEULE DROIT DE JUGER SI NOUS PLAISANTONS; DÈS QU'ON LA BLESSE, ELLE N'EST PLUS RAILLÉE, ELLE EST OFFENSÉE . NUL BADINAGE N'EST INNOCENT, DÈS QU'IL OFFENSE: AINSI, M DAINVILLE A EU TORT; MAIS CE TORT PEUT-IL ÊTRE COMPARÉ AU VÔTRE? VOUS QUI DEVEZ DE L'AMITIÉ, DU RESPECT ET DE LA RÉCONNAISSANCE ÀMISS BRIDGET, VOUS LA FÂCHEZ DE GAIETÉ DE CŒUR, VOUS RIEZ DE CE QUI LUI DÉPLAÎT, ET VOUS VOULEZ LUI DONNER UN RIDICULE. SI VOUS AVIEZ QUELQUES ANNÉES DE PLUS, CETTE FAUTE SI GRAVE PROUVERAIT À LA FOIS QUE VOUS AVEZ UN MAUVAIS CŒUR, ET QUE VOUS MANQUEZ D'ESPRIT. À CES MOTS, ADÈLE A PLEURÉ.-AH, MAMAN! COMMENT POURRAI-JE RÉPARER...-EN MONTRANT À MISS BRIDGET UN VRAI REPENTIR; CEPENDANT, N'ESPÉREZ PAS DE LA RAMENER EN UN JOUR; ELLE AVAIT POUR VOUS UNE VÉRITABLE TENDRESSE, MAIS VOUS VENEZ DE LUI DONNER UNE SI MAUVAISE OPINION DE VOTRE CARACTÈRE, QU'ELLE EST TRÈS-FONDÉE À DOUTER DE VOTRE AFFECTION POUR ELLE, ET...-OH, ELLE SAIT BIEN QUE JE L'AIME...-ELLE NE LIT PAS DANS VOTRE ÂME, ELLE NE PEUT VOUS JUGER QUE D'APRÈS VOS ACTIONS; ET VOTRE PROCÉDÉ MONTRE TANT D'INGRATITUDE! ...-MAIS JE NE SUIS QU'UN ENFANT...-AUSSI NE VOUS JUGERA-T-ELLE PAS SANS RETOUR, ELLE N'AURA QUE DES DOUTES, QUE DES SOUPÇONS QUE VOUS POURREZ FACILEMENT DÉTRUIRE AVEC LE TEMPS. ET SI VOUS N'ÉTIEZ POINT UN ENFANT, VOUS AURIEZ PERDU AUJOURD'HUI POUR JAMAIS SA TENDRESSE ET LA MIENNE.-Ô MON DIEU! ... MAMAN, VOUS AVEZ DONC AUSSI DES DOUTES...-MAIS JE VOUS AVOUE QUE VOTRE ACTION ME SURPREND ET M'AFFLIGE ÉGALEMENT; J'AVAIS DE VOUS UNE OPINION SI DIFFÉRENTE! ... JE NE COMPRENDS PAS QUE MISSBRIDGET AIT PU S'OFFENSER DES PLAISANTERIES DE DAINVILLE, CAR TOUT CE QUI N'ATTAQUE NI L'HONNEUR NI LE CARACTÈRE NE DOIT JAMAIS FÂCHER; MAIS ENFIN, QUAND J'AI VU QU'ELLE AVAIT CETTE FAIBLESSE, J'AUROIS VOULU POUVOIR LA CACHER À TOUT LE MONDE; J'AI PARTAGÉ SON EMBARRAS, QUOIQU'IL NE FÛT PAS FONDÉ, PARCE QUE TOUTE PERSONNE QUI SOUFFRE A LE DROIT D'INTÉRESSER UN BON CŒUR. PAR EXEMPLE, IL Y A DES GENS MAL ÉLEVÉS, ET AUXQUELS LEURS PARENTS ONT LAISSÉ PRENDRE DES ANTIPATIES RIDICULES ET EXTRAVAGANTES. J'AI CONNU UNE FEMME QUI S'ÉVANOUISSOIT EN VOYANT UN CHAT...-UN CHAT! ...-OUI, ELLE AVAIT CETTE FAIBLESSE; EH BIEN, JE LA PLAIGNAIS DOUBLEMENT, D'ABORD, DE SOUFFRIR, ET SECONDEMENT, D'AVOIR EU UNE MAUVAISE ÉDUCATION. JE ME DISAIS, SI L'ON M'EÛT ÉLEVÉE COMME ELLE, J'AUROIS CETTE FOLIE OU QUELQU'AUTRE SEMBLABLE; ET JE N'AVAIS PAS LA SOTTISE DE M'ENORGUEILLIR D'AVOIR PLUS DE RAISON: SEULEMENT JE REMERCIOIS DIEU DE M'AVOIR DONNÉ DES PARENTS VIGILANS, ÉCLAIRÉS ET TENDRES, ET JE ME SENTAIS POUR CETTE FEMME UNE COMPASSION PLEINE D'INTÉRÊT ET UNE VÉRITABLE INDULGENCE. J'AI TERMINÉ CET ENTRETIEN, QUE JE VOUS ABRÈGE EXTRÊMEMENT, EN DÉCLARANT À ADÈLE QU'ELLE NE VIENDRAIT POINT AVEC NOUS CHEZ NICOLE, ET QUE, PENDANT TROIS JOURS, ELLE DÎNEROIT ET SOUPEROIT DANS SA CHAMBRE. ELLE A REÇU CETTE RIGOUREUSE PUNITION AVEC UNE SOUMISSION PARFAITE, CAR ELLE SAIT BIEN QUE LE PLUS LÉGER MURMURE PROLONGEROIT SA PÉNITENCE; AUSSI, LES REÇOIT-ELLE AVEC AUTANT DE DOUCEUR QUE DE CHAGRIN. JE SUIS CONVENUE AVEC MISSBRIDGET, QU'ELLE SERAIT AU MOINS SIX SEMAINES SANS TRAITER ADÈLE COMME À L'ORDINAIRE; ELLE LUI DIRA QU'ELLE N'A NULLE ESPÈCE DE RANCUNE, MAIS QU'IL NE LUI EST PAS POSSIBLE DE COMPTER SUR L'AFFECTION D'UNE PERSONNE DONT ELLE A ÉTÉ TRAITÉE AVEC SI PEU D'ÉGARDS. ET MOI, JE DIRAI À LA COUPABLE ET REPENTANTE ADÈLE: VOYEZ CE QU'UNE LÉGÈRETÉ PEUT NOUS COÛTER; UNE PLAISANTERIE QUI VOUS A MÉDIOCREMENT AMUSÉE UNE DEMI-HEURE, VOUS FAIT PERDRE L'AMITIÉ D'UNE PERSONNE QUI DOIT VOUS ÊTRE CHÈRE, ALTÈRE L'OPINION QUE J'AVAIS DE VOUS; ENFIN, VOUS REND SUSPECTE À TOUT LE MONDE, ET VOUS ATTIRE UNE PÉNITENCE DE TROIS JOURS. 
LETTRE 35 DE LA MÊME À LA MÊME. J'AI ÉTÉ BIEN LONG-TEMPS SANS VOUS ÉCRIRE, MA CHÈRE AMIE, MAIS, DEPUIS MA DERNIÈRE LETTRE, J'AI ÉTÉ TÉMOIN D'UNE SCÈNE SI TOUCHANTE, ET DONT LES SUITES CRUELLES M'ONT SI SINGULIÈREMENT AFFECTÉE, QUE, DANS CES PREMIERS MOMENT, JE N'AUROIS PAS ÉTÉ EN ÉTAT DE VOUS FAIRE LES DÉTAILS QUE VOUS DESIREREZ SÛREMENT, QUAND VOUS SAUREZ QU'ILS SONT TOUS RELATIFS À LA MALHEUREUSE CÉCILE. OH, C'EST MAINTENANT QU'ELLE EST À PLAINDRE! ... ET VOUS ALLEZ JUGER SI JAMAIS DANS AUCUN TEMPS DE SA VIE, ELLE FUT PLUS DIGNE D'EXCITER VOTRE COMPASSION. JE VOUS MANDOIS, DANS MA DERNIÈRE LETTRE, LE MOT ÉCHAPPÉ À CÉCILE AU SUJET DE SA PROFESSION QUI SE FIT LE 16 DE MAI , (ÉPOQUE À PRÉSENT DOUBLEMENT FUNESTE POUR ELLE! ) ET QUE POUR LA DISTRAIRE DE CETTE IDÉE, NOUS AVIONS PROJETÉ UNE PROMENADE JUSQU'À LA MAISON DE NICOLE. EN EFFET, NOUS PARTÎMES À CINQ HEURES DU SOIR, M D'AIMERI, M ETMADAME DE VALMONT, CÉCILE, M D'ALMANE, CHARLES, THÉODORE ET MOI, TOUS ENSEMBLE DANS LA MÊME CALÈCHE. JE CRUS M'APERCEVOIR EN VOITURE QUE CÉCILE PRENAIT PEU DE PART À LA CONVERSATION, ELLE PARAISSAIT VIVEMENT OCCUPÉE DU PLAISIR D'ADMIRER LES BEAUTÉS DE LA CAMPAGNE, ET LES DIFFÉRENTS POINTS DE VUE QUI S'OFFRAIENT SUR NOTRE PASSAGE; ET DE TEMPS EN TEMPS UN SOUPIR ÉCHAPPÉ MALGRÉ ELLE, SEMBLAIT DIRE: HEUREUX CEUX AUXQUELS ON N'A POINT RAVI LA LIBERTÉ DE CONTEMPLER TOUJOURS UN SI BEAU SPECTACLE! ... ENFIN, NOUS APPROCHONS DE L'HABITATION DE NICOLE; N'AYANT PLUS QUE CINQ CENT PAS À FAIRE POUR Y ARRIVER, M DE VALMONTNOUS PROPOSA D'Y ALLER À PIED, AFIN, DIT-IL, DE SURPRENDRE LES BONNES GENS DANS L'INTÉRIEUR DE LEUR MÉNAGE. NOUS DESCENDÎMES DE VOITURE, ET APRÈS AVOIR TRAVERSÉ UNE GRANDE PRAIRIE, NOUS ENTRÂMES DANS UNE ALLÉE DE SAULES QUI NOUS CONDUISIT À LA MAISON DE NICOLE; CETTE PETITE CABANE COUVERTE DE CHAUME, EST AU MILIEU D'UN JARDIN ASSEZ VASTE, ENTOURÉ D'UNE HAIE D'ÉPINE FLEURIE; DES FRUITS D'UNE BEAUTÉ PARFAITE, UNE VUE DÉLICIEUSE, UN AIR PARFUMÉ, DES RUISSEAUX D'UNE EAU PURE ET TRANSPARENTE QUI SE CROISENT SOUS LES PAS EN SERPENTANT SUR UN GAZON PARSEMÉ DE VIOLETTES ET DE THIM: TOUS CES DIFFÉRENTS OBJETS RENDENT CETTE HABITATION CHAMPÊTRE UN DES PLUS AGRÉABLES SÉJOURS DE L'UNIVERS. 
ARRIVÉS PRÈS DE LA CHAUMIÈRE, THÉODORE NOUS DEVANCE, OUVRE LA PORTE ET NOUS ENTRONS TOUS; NOUS TROUVONS LA JEUNE FERMIÈRE ASSISE ENTRE SA MÈRE ET SON MARI, ELLE TENAIT DANS SES BRAS LE PLUS JEUNE DE SES ENFANTS, SA FILLE AÎNÉE, À GENOUX DEVANT ELLE, CARESSAIT SON PETIT FRÈRE, ET LA SECONDE ÉTAIT DEBOUT, LE VISAGE NONCHALAMMENT APPUYÉ SUR L'ÉPAULE DE SON PÈRE.NOUS AURIONS DÉSIRÉ POUVOIR CONTEMPLER QUELQUES INSTANTS CE TABLEAU CHARMANT, CETTE IMAGE TOUCHANTE DE L'UNION ET DU BONHEUR, MAIS AUSSI-TÔT QUE LES PAYSANS NOUS APERÇURENT, ILS SE LEVÈRENT. NICOLE DIT À SON MARI D'ALLER CUEILLIR DES FLEURS, LA BONNE MÈRE VA CHERCHER DU LAIT, DE LA CRÈME, ET DRESSE UNE TABLE: PENDANT CE TEMPS-LÀ NOUS ADMIRONS L'ORDRE ET LA PROPRETÉ DE LA MAISON, NOUS CARESSONS LES ENFANTS; ET LA JEUNE FERMIÈRE NOUS ENTRETIENT DE SON BONHEUR ET DE SA TENDRESSE POUR SA FAMILLE. CEPENDANT LE MARI REVIENT AVEC UNE CORBEILLE REMPLIE DE BOUQUETS, ON NOUS OFFRE DES FRUITS, DES FLEURS, DU LAITAGE; ET TANDIS QUE CES BONNES-GENS S'EMPRESSENT ET S'AGITENT AUTOUR DE NOUS, M D'AIMERI S'APERÇOIT QUECÉCILE N'EST PLUS AUPRÈS DE LUI: IL LA VOIT À L'AUTRE BOUT DE LA CHAMBRE RETIRÉE DANS UN COIN, IL S'APPROCHE D'ELLE, L'INFORTUNÉE DÉTOURNE LA TÊTE... IL LA REGARDE, ELLE ÉTAIT PÂLE ET TREMBLANTE, ET SON VISAGE ÉTAIT BAIGNÉ DE PLEURS; ELLE VEUT PARLER, SES SANGLOTS LA SUFFOQUENT... SA SŒUR ACCOURT, ETCÉCILE, CONFUSE ET DÉSESPÉRÉE, LUI DIT TOUT BAS, D'UNE VOIX ENTRECOUPÉE: ARRACHEZ-MOI D'ICI, JE ME MEURS... MADAME DE VALMONT, AUSSI SURPRISE QU'AFFLIGÉE, VEUT EN VAIN CHERCHER UN PRÉTEXTE À L'ÉTAT DE SA MALHEUREUSE SŒUR; SON PÈRE N'AVAIT QUE TROP FACILEMENT PÉNÉTRÉ LA VÉRITÉ: NE POUVANT SUPPORTER CET AFFREUX SPECTACLE, TOUT-À-COUP IL PREND LE JEUNECHARLES PAR LA MAIN, ET L'ENTRAÎNANT AVEC LUI, IL SORT IMPÉTUEUSEMENT DE LA CHAUMIÈRE; M D'ALMANE ET M DE VALMONT SORTENT AUSSI-TÔT, DANS L'INTENTION DE LE REJOINDRE ET DE RETOURNER AU CHÂTEAU À PIED AVEC LUI. ENFIN, NOUS ARRACHONS CÉCILE DE CETTE MAISON SI FUNESTE POUR ELLE, ET NOUS REMONTONS EN VOITURE. PENDANT TOUT LE CHEMIN ELLE NE PRONONÇA PAS UNE SEULE PAROLE, ELLE EUT CONSTAMMENT LA TÊTE BAISSÉE SUR SA POITRINE ET LES YEUX PRESQUE FERMÉS; PÉNÉTRÉE DE SA SITUATION, JE VOULUS UNE FOIS LUI PRENDRE LA MAIN ET L'EMBRASSER, MAIS ELLE ROIDIT SON BRAS AVEC UN AIR SOMBRE ET CHAGRIN, ET ELLE RESTA IMMOBILE SANS ME REGARDER: CAR UN DES PLUS FUNESTES EFFETS DU DÉSESPOIR, EST DE DESSÉCHER L'ÂME ET DE RENDRE INSENSIBLE À LA COMPASSION QU'ON INSPIRE. CEPENDANT CÉCILE EST NATURELLEMENT SI TENDRE, QU'ELLE NE TARDA PAS À SE REPENTIR DE L'ESPÈCE DE DURETÉ QU'ELLE VENAIT DE ME TÉMOIGNER; EN ARRIVANT AU CHÂTEAU ELLE ME SERRA LA MAIN ET M'EMBRASSA AVEC L'EXPRESSION DE LA PLUS VIVE RÉCONNAISSANCE: AUSSI-TÔT QUE J'EUS LAISSÉ AUX DEUX SŒURS LA LIBERTÉ DE S'ENTRETENIR SANS CONTRAINTE, ET QU'ELLES FURENT SEULES L'UNE ET L'AUTRE, CÉCILE PRÉVENANT LA CURIOSITÉ DE MADAME DE VALMONT, ET SE JETANT DANS SES BRAS EN VERSANT UN TORRENT DE LARMES: ""apprenez, lui dit-elle, tou","(174240, 174319)","(253971, 288693)"
