filename	au-name	title	au-gender	firsted-yr	printSource-yr	form	spelling	data-capture	token count	size	bgrf	author_wikidata	title_wikidata
Abbes_Voyage	Abbes de Cabreroles, Guillaume	Voyage dans les espaces	M	1758	1758	autodiegetic	historical	double keying	5601	short	58.5	Q3120241	NA
Anonym_Suzon	Anonym	Mémoires de Suzon, soeur de Dom Bougre	U	1778	1778	autodiegetic	modern	semi-automatic transcription	29294	short	83.9	Q4233718	NA
Anonyme_Zoloe	Anonym	Zoloé et ses deux acolythes	U	1800	1800	heterodiegetic	modern	semi-automatic transcription	18089	short	00.37	Q4233718	Q72044301
Arnaud_Adelson	François-Thomas-Marie de Baculard d’Arnaud	Adelson et Salvini, anecdote anglaise	M	1772	1773	heterodiegetic	historical	semi-automatic transcription	26425	short	72.10	Q548610	NA
Arnaud_Anne	François-Thomas-Marie de Baculard d’Arnaud	Anne Bell, histoire anglaise	M	1769	1773	heterodiegetic	modern	semi-automatic transcription	18686	short	69.12	Q548610	NA
Arnaud_Batilde	François-Thomas-Marie de Baculard d’Arnaud	Bathilde ou l’héroïsme de l’amour, anecdote historique par M. d’Arnaud	M	1767	1773	heterodiegetic	historical	semi-automatic transcription	15692	short	67.14	Q548610	NA
Arnaud_Clary	François-Thomas-Marie de Baculard d’Arnaud	Clary ou le retour à la vertu récompensé	M	1767	1773	mixed	modern	semi-automatic transcription	14367	short	67.15	Q548610	NA
Arnaud_Epoux	François-Thomas-Marie de Baculard d’Arnaud	Les époux malheureux, ou Histoire de monsieur ou madame de La Bédoyère.	M	1745	1803	autodiegetic	modern	semi-automatic transcription	76729	medium	83.15	Q548610	NA
Arnaud_Fanny	François-Thomas-Marie de Baculard d’Arnaud	Fanny, histoire anglaise	M	1764	1773	autodiegetic	modern	semi-automatic transcription	17766	short	64.14	Q548610	NA
Arnaud_Julie	François-Thomas-Marie de Baculard d’Arnaud	Julie ou l’heureux repentir, anecdote historique par M. d’Arnaud	M	1767	1773	heterodiegetic	historical	semi-automatic transcription	17122	short	67.16	Q548610	NA
Arnaud_Lucie	François-Thomas-Marie de Baculard d’Arnaud	Lucie et Mélanie ou les deux sœurs généreuses	M	1767	1773	heterodiegetic	modern	semi-automatic transcription	13017	short	67.17	Q548610	NA
Arnaud_Matinees	François-Thomas-Marie de Baculard d’Arnaud	Les matinées	M	1798	1799	heterodiegetic	historical	semi-automatic transcription	76554	medium	99.43	Q548610	NA
Arnaud_Nancy	François-Thomas-Marie de Baculard d’Arnaud	Nancy ou les malheurs de l’imprudence et de la jalousie, histoire imitée de l’anglais, par M. d’Arnaud	M	1767	1773	heterodiegetic	historical	semi-automatic transcription	17504	short	67.18	Q548610	NA
Arnaud_Sargines	François-Thomas-Marie de Baculard d’Arnaud	Sargines, nouvelle	M	1772	1773	heterodiegetic	modern	semi-automatic transcription	22138	short	72.11	Q548610	NA
Arnaud_Selicourt	François-Thomas-Marie de Baculard d’Arnaud	Sélicourt, nouvelle	M	1769	1773	heterodiegetic	modern	semi-automatic transcription	18754	short	69.13	Q548610	NA
Arnaud_Sidney	François-Thomas-Marie de Baculard d’Arnaud	Sidney et Volsan, histoire anglaise	M	1766	1773	autodiegetic	modern	semi-automatic transcription	18053	short	66.9	Q548610	NA
Arnaud_Zenothemis	François-Thomas-Marie de Baculard d’Arnaud	Zénothémis, anecdote marseilloise par M. d’Arnaud	M	1773	1773	heterodiegetic	historical	semi-automatic transcription	18678	short	73.9	Q548610	NA
BarbeMarbois_Parisienne	François marquis de Barbé-Marbois	La Parisienne en province, ouvrage national, par M....	M	1769	1769	heterodiegetic	historical	semi-automatic transcription	28964	short	69.14	Q708732	NA
Barthe_Femme	Nicolas-Thomas Barthe	La jolie femme ou la femme du jour	M	1769	1769	heterodiegetic	historical	semi-automatic transcription	62780	medium	69.15	Q3340819	NA
Beauharnais_Lettres	Fanny de Beauharnais	Lettres de Stéphanie, roman historique	F	1778	1778	epistolary	historical	double keying, semi-automatic transcription	130032	long	78.12	Q446559	NA
Beaumont_Clarice	Leprince de Beaumont, Jeanne-Marie	La nouvelle Clarice, histoire véritable	F	1767	1767	epistolary	historical	double keying	135342	long	67.36	Q466788	NA
Beckford_Vathek	William Beckford	Vathek: conte arabe	M	1787	1787	heterodiegetic	modern	semi-automatic transcription	35146	short	87.25	Q361456	Q54548
Bellin_Nuit	Louis François Marie Bellin de La Liborlière	La Nuit anglaise	M	1799	1799	heterodiegetic	historical	semi-automatic transcription	47089	medium	99.44	Q3261946	NA
Benoist_Elisabeth	Françoise-Albine Puzin de La Martinière Benoist	Elisabeth: Roman Par Madame ***	F	1766	1766	epistolary	historical	double keying	84717	medium	66.11	Q3086371	NA
Benouville_Pensees	Bonne-Charlotte de Bénouville	Les pensées errantes ; avec quelques lettres d'un Indien	F	1758	1758	epistolary	historical	double keying	39063	short	58.8	NA	NA
Bernardin_Chaumiere	Jacques Henri Bernardin de Saint-Pierre	Chaumière Indienne	M	1791	1829	heterodiegetic	modern	semi-automatic transcription	13551	short	91.43	Q361976	Q42187814
Bernardin_Paul	Jacques Henri Bernardin de Saint-Pierre	Paul et Virginie	M	1787	1806	homodiegetic	modern	semi-automatic transcription	64366	medium	88.101	Q3261946	NA
Berquin_Enfants	Arnaud Berquin	L'ami des Enfants	M	1782	1845	mixed	modern	semi-automatic transcription	38322	short	82.14	Q350566	Q42185919
Blanchard_Philetas	Pierre Blanchard	Philétas, Roman pastoral	M	1800	1800	autodiegetic	historical	semi-automatic transcription	27279	short	00.50	Q21416437	NA
Boufflers_Reine	Stanislas-Jean de Boufflers	La Reine de Golgonde	M	1760	1761	autodiegetic	modern	semi-automatic transcription	4444	short	61.6	Q918355	NA
Cazotte_Diable	Jacques Cazotte	Le Diable amoureux	M	1772	1871	autodiegetic	modern	semi-automatic transcription	26069	short	72.17	Q425373	Q1994609
Cazotte_Honneur	Jacques Cazotte	L'Honneur perdu et recouvré	M	1788	1817	heterodiegetic	modern	semi-automatic transcription	14964	short	88.41	Q425373	NA
Cazotte_Ollivier	Jacques Cazotte	Ollivier	M	1763	1817	heterodiegetic	historical	semi-automatic transcription	59530	medium	63.19	Q425373	NA
Charriere_Caliste	Isabelle de Charrière	Caliste ou continuation des Lettres écrites de Lausanne	F	1787	1787	mixed	modern	semi-automatic transcription	29960	short	87.30	Q123386	NA
Charriere_Femmes	Isabelle de Charrière	Trois Femmes	F	1795	1795	heterodiegetic	modern	semi-automatic transcription	40344	short	96.18	Q123386	NA
Charriere_Lausanne	Isabelle de Charrière	Lettres écrites de Lausanne	F	1785	1787	autodiegetic	modern	semi-automatic transcription	23794	short	85.24	Q123386	NA
Chevrier_Colporteur	François-Antoine Chevrier	Le Colporteur : histoire morale et critique	M	1761	1761	heterodiegetic	modern	semi-automatic transcription	42999	short	62.11	Q3083281	NA
Constant_Laure	Samuel de Constant de Rebecque	Laure, ou Lettres de quelques personnes de Suisse	M	1787	1787	epistolary	historical	double keying	274876	long	86.27	Q55229494	NA
Cottin_Claire	Sophie Cottin	Claire d’Albe	F	1798	1824	epistolary	modern	semi-automatic transcription	40093	short	99.62	Q464409	Q2975140
Crebillon_Atheniennes	Claude Prosper Jolyot de Crébillon	Lettres athéniennes extraites du porte-feuille d'Alcibiade	M	1771	1771	NA	modern	semi-automatic transcription	181353	long	71.23	Q733161	NA
Crebillon_Conte	Claude Prosper Jolyot de Crébillon	Ah quel conte !	M	1751	1779	heterodiegetic	historical	semi-automatic transcription	135939	long	54.13	Q733161	NA
Crebillon_Nuit	Claude Prosper Jolyot de Crébillon	La Nuit et le moment, ou les Matines de Cythère, dialogue	M	1755	1756	dialogue novel	modern	semi-automatic transcription	32281	short	55.16	Q733161	Q30738391
Denon_Point	Dominique-Vivant Denon	Point de lendemain	M	1777	1876	autodiegetic	modern	semi-automatic transcription	7836	short	79.15	Q468618	NA
Diderot_Jacques	Denis Diderot	Jacques le fataliste et son maître	M	1796	1765-1784	dialogue novel	modern	semi-automatic transcription	93744	medium	97.21	Q448	Q945216
Diderot_Neveu	Denis Diderot	Le Neveu de Rameau	M	NA	1862	dialogue novel	modern	semi-automatic transcription	33211	short	1	Q448	NA
Diderot_Religieuse	Denis Diderot	La Religieuse	M	1796	1875	autodiegetic	modern	semi-automatic transcription	65542	medium	97.22	Q448	Q1209658
Diderot_Supplement	Denis Diderot	Supplément au voyage de Bougainville	M	1796	1796	dialogue novel	modern	semi-automatic transcription	15831	short	98.38	Q448	NA
Doppet_Memoires	François Amédée Doppet	Mémoires de Mme de Warens, suivis de ceux de Claude Anet	M	1786	1786	autodiegetic	historical	double keying	34946	short	86.32	Q3083791	NA
Dorat_Malheurs	Claude-Joseph Dorat	Les Malheurs de l'inconstance ou Lettres de la marquise de Circé et du comte de Mirbelle	M	1772	1775	epistolary	historical	semi-automatic transcription	68517	medium	72.19	Q361456	NA
Dorat_Sacrifices	Claude-Joseph Dorat	Les Sacrifices de l’amour	M	1771	1771	epistolary	historical	semi-automatic transcription	75519	medium	71.25	Q361456	NA
Ducray_Cinquante	François Guillaume Ducray-Duminil	Les Cinquante francs de Jeannette, par le Cen Ducray-Duminil	M	1798	1798	heterodiegetic	historical	double keying	72560	medium	99.76	Q2072208	NA
Dulaurens_Compere	Henri-Joseph Dulaurens	Le Compère Mathieu ou les Bigarrures de l'esprit humain	M	1766	1831	homodiegetic	modern	semi-automatic transcription	145307	long	66.21	Q345858	NA
Dulaurens_Imirce	Henri-Joseph Dulaurens	Imirce ou la Fille de nature	M	1765	1922	autodiegetic	modern	OCR	70054	medium	65.21	Q345858	NA
Fievee_Dot	Joseph Fiévée	La Dot de Suzette, ou Histoire de Mme de Senneterre racontée par elle-même	M	1797	1826	heterodiegetic	historical	semi-automatic transcription	33262	short	98.41	Q3184948	Q107275176
Florian_Estelle	Jean-Pierre Claris de Florian	Estelle	M	1788	1838	heterodiegetic	historical	double keying	33714	short	88.53	Q551740	NA
Florian_Galatee	Jean-Pierre Claris de Florian	Galatée	M	1783	1812	heterodiegetic	historical	double keying	21849	short	83.26	Q551740	NA
Florian_Numa	Jean-Pierre Claris de Florian	Numa Pompilius	M	1786	1786	mixed	modern	semi-automatic transcription	71429	medium	86.34	Q551740	NA
Fourqueux_Zely	Marie-Louise Auget de Monthyon, Madame de Fourqueux	Zély	F	1775	1775	heterodiegetic	historical	double keying	25494	short	75.28	Q33141030	NA
Genlis_Adele	Stéphanie Félicité Ducrest de Saint-Aubin de Genlis	Adèle et Théodore	F	1782	1782	epistolary	historical	semi-automatic transcription	262122	long	82.20	Q55037230	NA
Genlis_Chevaliers	Stéphanie Félicité Ducrest de Saint-Aubin de Genlis	Les Chevaliers du cygne	F	1795	1795	heterodiegetic	historical	semi-automatic transcription	193036	long	95.20	Q55037230	NA
Gerard_Comte	Philippe Louis Gérard	Le Comte de Valmont ou les égarements de la raison, lettres recueillies et publiées	M	1774	1775	epistolary	historical	semi-automatic transcription	180258	long	74.15	Q60151324	NA
Gorjy_Voyage	Jean-Claude Gorgy	Nouveau voyage sentimental	M	1791	1791	autodiegetic	historical	double keying	19017	short	84.27	Q15407023	NA
Jacquin_Parisiennes	Armand-Pierre Jacquin	Lettres parisiennes sur le désir d'être heureux	M	1758	1758	epistolary	historical	double keying	61934	medium	58.13	Q60842185	NA
Laclos_Liaisons	Pierre Choderlos de Laclos	Les Liaisons dangereuses	M	1782	1869	epistolary	modern	semi-automatic transcription	147847	long	82.17	Q212476	Q862050
Lagrave_Sophie	Comtesse de Lagrave	Sophie de Beauregard, ou Le véritable amour	F	1798	1798	epistolary	historical	double keying	57935	medium	99.104	NA	NA
Lagrave_Zabeth	Comtesse de Lagrave	Zabeth, ou la Victime de l'ambition	F	1798	1798	heterodiegetic	historical	double keying	73683	medium	99.105	NA	NA
Lavaux_Eusebe	Laveaux, Jean-Charles	Eusèbe, ou les Beaux profits de la vertu dans le siècle où nous vivons	M	1785	1785	heterodiegetic	historical	OCR	29894	short	85.33	Q649330	NA
Leonard_Clementine	Nicolas-Germain Léonard	La Nouvelle Clémentine, ou Lettres de Henriette du Berville	M	1774	1774	epistolary	modern	semi-automatic transcription	13553	short	74.20	Q970715	NA
Leonard_Lettres	Nicolas-Germain Léonard	Lettres de deux amants habitants de Lyon	M	1783	1783	epistolary	historical	double keying	66934	medium	83.31	Q970715	NA
Lesuire_Aventurier	Robert-Martin Lesuire	L'Aventurier François ou Mémoires de Grégoire Merveil	M	1782	1782	autodiegetic	historical	double keying	218774	long	82.27	Q3434367	NA
Lesuire_Crime	Robert-Martin Lesuire	Le crime, ou Lettres originales, contenant les aventures de César de Perlencour	M	1789	1789	epistolary	historical	double keying	178990	long	89.81	Q3434367	NA
Loaisel_Ainsi	Joseph Marie Loaisel de Tréogate	Ainsi finissent les grandes passions, ou les Dernières amours du chevalier de ***	M	1788	1788	epistolary	modern	semi-automatic transcription	69750	medium	87.54bis	Q56062794	NA
Loaisel_Comtesse	Joseph Marie Loaisel de Tréogate	La Comtesse d'Alibre	M	1779	1779	heterodiegetic	historical	double keying	31565	short	79.22	Q56062794	NA
Loaisel_Dolbreuse	Joseph de Loaisel de Tréogate	Dolbreuse ou l'Homme du siècle ramené à la vérité par le sentiment et la raison	M	1783	1783	autodiegetic	modern	semi-automatic transcription	65768	medium	83.33	Q56062794	NA
Louvet_Annee	Jean-Baptiste Louvet de Couvray	Une année dans la vie du chevalier de Faublas	M	1787	1960	autodiegetic	historical	semi-automatic transcription	119518	long	87.56	Q1362457	NA
Louvet_Fin	Jean-Baptiste Louvet de Couvrai	La Fin des amours de Faublas	M	1790	1884	autodiegetic	historical	semi-automatic transcription	73119	medium	90.47	Q1362457	Q91971388
Maistre_Voyage	Xavier de Maistre	Voyage autour de ma chambre	M	1794	1839	autodiegetic	modern	semi-automatic transcription	19704	short	94.8	Q2737006	Q10392559
Marmontel_Belisaire	Jean-François Marmontel	Bélisaire	M	1767	1767	heterodiegetic	modern	semi-automatic transcription	44239	short	67.39	Q379923	Q5005038
Marmontel_Contes	Jean-François Marmontel	Contes moraux	M	1761	1829	heterodiegetic	modern	semi-automatic transcription	130232	long	61.12	Q379923	NA
Marmontel_Incas	Jean-François Marmontel	Les Incas ou la destruction de l'empire du Pérou	M	1777	1777	heterodiegetic	modern	semi-automatic transcription	109917	long	77.50	Q379923	Q106889862
Merard_Bergeries	Anne-Jeanne-Félicité Mérard de Saint-Just	Bergeries et opuscules de Mlle d'Ormoy l'aînée	F	1784	1784	dialogue novel	historical	double keying	19894	short	84.43	Q4252921	NA
Mercier_An	Louis-Sébastien Mercier	L'An deux mille quatre cent quarante, rêve s'il en fut jamais	M	1771	1774	autodiegetic	NA	NA	68158	medium	71.36	Q709670	Q82530
Mercier_Jezennemours	Louis-Sébastien Mercier	Jezennemours : roman dramatique	M	1776	1776	mixed	historical	semi-automatic transcription	78873	medium	76.36	Q709670	NA
Mirabeau_Conversion	Honoré-Gabriel Riqueti de Mirabeau	Ma Conversion ou le Libertin de qualité	M	1783	1801	autodiegetic	modern	semi-automatic transcription	39962	short	83.40	Q218747	NA
Mirabeau_Rideau	Honoré-Gabriel Riqueti de Mirabeau	Le Rideau levé ou l'éducation de Laure	M	1786	1921	autodiegetic	modern	semi-automatic transcription	43539	short	86.51	Q218747	Q19198685
Montesquieu_Arsace	Charles-Louis de Secondat, baron de La Brède et de Montesquieu	Arsace et Isménie : histoire orientale	M	1755	1949	heterodiegetic	historical	semi-automatic transcription	14228	short	83.42	Q15975	NA
Morelly_Naufrage	Étienne-Gabriel Morelly	Naufrage des Iles Flottantes	M	1753	1753	heterodiegetic	historical	double keying	99913	medium	53.26	Q289139	Q56391765
Mouhy_Opuscule	Charles de Fieux chevalier de Mouhy	Opuscule d’un célèbre auteur égyptien, contenant l’histoire d’Orphée par laquelle on pourroit soupçonner qu’il est peu de femmes fidèles	M	1752	NA	mixed	historical	semi-automatic transcription	5306	short	52.35	Q2960572	NA
Nerciat_Aphrodites	Robert-André Andréa de Nerciat	Les Aphrodites	M	1764	1793	dialogue novel	historical	double keying	110529	long	93.16	Q718081	Q3230640
Nerciat_Etourdi	Robert-André Andréa de Nerciat	L'Étourdi	U	1784	1784	autodiegetic	modern	semi-automatic transcription	45727	short	84.50	Q718081	NA
Nerciat_Felicia	Robert-André Andréa de Nerciat	Félicia ou mes Fredaines	M	1775	1778	autodiegetic	modern	semi-automatic transcription	100569	medium	75.37	Q718081	Q20725904
PigaultLebrun_Adele	Charles-Antoine-Guillaume Pigault de l’Epinay, dit Pigault-Lebrun	Adèle et D'Abligny, par Pigault-Lebrun	M	NA	1800	heterodiegetic	historical	semi-automatic transcription	20215	medium	00.119	Q3388279	NA
PigaultLebrun_Kinglin	Charles-Antoine-Guillaume Pigault de l’Epinay, dit Pigault-Lebrun	Monsieur de Kinglin, ou la prescience	M	1800	1823	heterodiegetic	historical	semi-automatic transcription	21942	short	00.122	Q3388279	NA
PigaultLebrun_Metusko	Charles-Antoine-Guillaume Pigault de l’Epinay, dit Pigault-Lebrun	Métusko, ou les polonais	M	1800	1802	heterodiegetic	historical	semi-automatic transcription	19289	short	00.120	Q3388279	0
Popeliniere_Daira	Alexandre Jean Joseph Le Riche de La Popelinière	Daïra. Histoire orientale	M	1761	1761	autodiegetic	historical	double keying	45379	medium	60.21	Q2720200	Q28530619
Prevost_Monde	Antoine François Prévost	Le monde moral,: ou mémoires pour servir à l'histoire du cœur humain	M	1760	1766	autodiegetic	modern	semi-automatic transcription	148056	long	60.28	Q311483	NA
Puget_Periphas	Puget de Saint-Pierre	Les aventures de Periphas, descendant de Cécrops	M	1761	1761	heterodiegetic	historical	double keying	64565	medium	61.17	NA	NA
Quesne_Folies	Jacques Salbigoton Quesné	Les folies d’un conscrit	M	1800	1799	heterodiegetic	historical	semi-automatic transcription	43933	short	00.127	Q3159956	NA
Retif_AntiJustine	Nicolas-Edme Rétif de la Bretonne	L'Anti-Justine	M	1798	1798	autodiegetic	modern	semi-automatic transcription	57064	medium	98.84	Q732729	Q3202134
Retif_Paysan	Nicolas Rétif de la Bretonne	Le Paysan perverti ou les Dangers de la ville	M	1776	1776	epistolary	modern	semi-automatic transcription	227440	long	76.44	Q732729	NA
Retif_Paysanne	Nicolas-Edme Rétif de la Bretonne	La paysanne pervertie ou Les dangers de la ville	M	1784	1784	epistolary	modern	semi-automatic transcription	199461	long	84.58	Q732729	NA
Retif_Sara	Nicolas Rétif de la Bretonne	Histoire de Sara	M	1796	1883	mixed	modern	semi-automatic transcription	65625	medium	83.48	Q732729	NA
Retif_Vie	Nicolas Rétif de la Bretonne	La Vie de mon père	M	1779	1983	heterodiegetic	modern	semi-automatic transcription	57821	medium	79.31	Q732729	NA
Reveroni_Pauliska	Révéroni Saint-Cyr	Pauliska ou la Perversité moderne	M	1798	1798	autodiegetic	modern	semi-automatic transcription	64952	medium	98.85	Q3157878	Q3372783
Riccoboni_Histoire	Marie-Jeanne Riccoboni	Histoire du marquis de Cressy	F	1758	1814	heterodiegetic	modern	semi-automatic transcription	25982	short	58.17	Q3087936	NA
Riccoboni_LettreJuliette	Marie-Jeanne Riccoboni	Lettre de Milady Juliette Catesby à Milady Henriette Campley	F	1759	1759	epistolary	modern	semi-automatic transcription	33221	short	59.22	Q3087936	NA
Riccoboni_LettresAdelaide	Marie-Jeanne Riccoboni	Lettres d'Adelaïde de Dammartin, comtesse de Sancerre, à M. le Comte de Nancé, son ami	F	1767	1818	epistolary	modern	semi-automatic transcription	49408	short	67.44	Q3087936	NA
Riccoboni_LettresFanni	Marie-Jeanne Riccoboni	Lettres de Fanni Butler à Milord Charles Alfred de Caitombridge	F	1757	1757	epistolary	modern	semi-automatic transcription	32027	short	57.12	Q3087936	NA
Riccoboni_MissJenny	Marie-Jeanne Riccoboni	Histoire de Miss Jenny, écrite et envoyée par elle à Miladi, comtesse de Roscomond	F	1764	1818	autodiegetic	historical	semi-automatic transcription	94498	medium	64.39	Q3087936	NA
Riccoboni_MylordRivers	Marie-Jeanne Riccoboni	Lettres de Mylord Rivers à Sir Charles Cardigan	F	1776	1776	epistolary	historical	semi-automatic transcription	49147	short	77.57	Q3087936	NA
Rosny_Firmin	Joseph Rosny	Firmin ou le Jouet de la fortune	M	1798	1798	autodiegetic	modern	semi-automatic transcription	37304	short	98.88	Q52149410	Q57200464
Rousseau_Emile	Jean-Jacques Rousseau	Émile ou de l'éducation	M	1762	1780-1789	autodiegetic	modern	semi-automatic transcription	271453	long	62.33	Q6527	Q913599
Rousseau_Julie	Jean-Jaques Rousseau	Julie, ou La nouvelle Héloïse	M	1761	1774	epistolary	modern	semi-automatic transcription	291120	long	61.18	Q6527	NA
Sacy_Amours	Claude Louis Michel de Sacy	Les Amours de Mirtil	M	1761	1761	heterodiegetic	historical	double keying	13704	short	61.19	Q1096895	NA
Sade_120	Donatien de Sade	Les Cent Vingt Journées de Sodome	M	NA	1904	heterodiegetic	modern	semi-automatic transcription	166024	long	1	Q123867	NA
Sade_Aline	Donatien de Sade	Aline et Valcour ou le roman philosophique	M	1795	1795	epistolary	historical	semi-automatic transcription	297959	short	95.36	Q123867	Q629452
Sade_Infortunes	Donatien de Sade	Les Infortunes de la vertu	M	1787	1787	heterodiegetic	modern	semi-automatic transcription	53703	short	1	Q123867	NA
Sade_Justine	Donatien de Sade	Justine ou les Malheurs de la vertu	M	1791	1791	heterodiegetic	modern	semi-automatic transcription	119412	long	91.42	Q123867	Q1329470
Sade_Philosophie	Donatien de Sade	La Philosophie dans le boudoir	M	1791	1791	dialogue novel	modern	semi-automatic transcription	67671	medium	95.37	Q123867	Q1215417
Saurin_Mirza	Bernard-Joseph Saurin	Mirza et Fatmé, conte indien traduit de l’Arabe	M	1754	1754	heterodiegetic	historical	semi-automatic transcription	27491	medium	54.31	Q822205	0
Segur_Correspondance	Alexandre-Joseph-Pierre vicomte de Ségur	Correspondance secrète entre Ninon de Lenclos, le Marquis de Villarceaux et Madame M.	M	1789	1805	epistolary	historical	semi-automatic transcription	36922	medium	89.104	Q321684	NA
Senac_Emigre	Gabriel Sénac de Meilhan	L’Émigré	M	1797	1797	epistolary	historical	semi-automatic transcription	140007	long	97.74	Q3093966	NA
Souza_Adele	Adélaïde de Souza	Adèle de Senange	F	1794	1821	epistolary	modern	semi-automatic transcription	53365	short	94.13	Q589562	NA
Tiphaigne_Amilec	Tiphaigne de La Roche	Amilec, ou la Graine d'Hommes qui sert à peupler les planètes	M	1753	1754	autodiegetic	historical	semi-automatic transcription	17509	short	53.33	Q2958070	NA
Tiphaigne_Galligenes	Tiphaigne de La Roche	Histoire des Galligènes	M	1765	1765	heterodiegetic	historical	double keying	39652	short	65.50	Q2958070	NA
Tressan_Jehan	Louis-Elisabeth de Lavergne, comte de Tressan	Histoire du petit Jehan de Saintré, et de Gérard de Nevers, par Tressan	M	1780	1824	heterodiegetic	historical	semi-automatic transcription	28249	short	80.32	Q219622	NA
Tressan_Prince	Louis-Elisabeth de Lavergne, comte de Tressan	Histoires du petit Jehan de Saintré, et de Gérard de Nevers	M	1780	1824	heterodiegetic	historical	semi-automatic transcription	29406	short	80.33	Q219622	NA
Voisenon_Histoire	Claude Henri de Fusée de Voisenon	Histoire de la Félicité	M	1751	1781	heterodiegetic	modern	semi-automatic transcription	10888	short	51.42	Q2976734	NA
Voltaire_Candide	François-Marie Arouet Voltaire	Candide, ou l'Optimisme	M	1759	1791	heterodiegetic	modern	semi-automatic transcription	33824	short	59.25	Q9068	Q215894
Voltaire_Homme	François-Marie Arouet Voltaire	L’Homme aux quarante écus	M	1768	1877	homodiegetic	modern	semi-automatic transcription	23195	short	68.55	Q9068	Q3203608
Voltaire_Micromegas	François-Marie Arouet Voltaire	Micromégas	M	1752	1950	heterodiegetic	modern	semi-automatic transcription	7110	short	52.43	Q9068	Q1785978
Voltaire_Princesse	François-Marie Arouet Voltaire	La Princesse de Babylone	M	1768	1877	heterodiegetic	modern	semi-automatic transcription	27534	short	68.56	Q9068	Q3211934
